2016-04-18 12:06:12,INT-14522/16,PARKOWANIE POJAZDÓW W ODLEGŁOŚCI MNIEJSZEJ NIŻ 10 M OD SKRZYŻOWANIA PRZY ULICACH:1. . UL. PUSZCZYKOWSKAA UL.  ŚWIERADOWSKA2. UL. PUSZCZYKOWSKA A UL. DUSZNICKA 3. UL. PUSZCZYKOWSKA A UL. DŁUGOPOLSKA4. UL. DŁUGOPOLSKA A UL. KUDOWSKA5. UL. KUDOWSKA A UL. DUSZNICKA,NIEPRAWIDŁOWE PARKOWANIE,PUSZCZYKOWSKA /,,0,2016-04-18 15:59:20
2016-04-18 12:06:12,INT-14522/16,PARKOWANIE POJAZDÓW W ODLEGŁOŚCI MNIEJSZEJ NIŻ 10 M OD SKRZYŻOWANIA PRZY ULICACH:1. . UL. PUSZCZYKOWSKAA UL.  ŚWIERADOWSKA2. UL. PUSZCZYKOWSKA A UL. DUSZNICKA 3. UL. PUSZCZYKOWSKA A UL. DŁUGOPOLSKA4. UL. DŁUGOPOLSKA A UL. KUDOWSKA5. UL. KUDOWSKA A UL. DUSZNICKA,NIEPRAWIDŁOWE PARKOWANIE,PUSZCZYKOWSKA /,,100,2016-04-18 15:59:20
2016-04-18 12:06:41,INT-14523/16,PARKOWANIE POJAZDÓW ZA D-40 POZA MIEJSCAMI,NIEPRAWIDŁOWE PARKOWANIE,JEŻOWSKA /,,0,2016-04-18 18:39:27
2016-04-18 12:06:41,INT-14523/16,PARKOWANIE POJAZDÓW ZA D-40 POZA MIEJSCAMI,NIEPRAWIDŁOWE PARKOWANIE,JEŻOWSKA /,,100,2016-04-18 18:39:27
2016-04-18 12:09:19,INT-14524/16,Kontrola parkowania pojazdów na kopetrach dla osób niepełnoosprawnych,NIEPRAWIDŁOWE PARKOWANIE,SZAJNOCHY 7/7/,MANDAT,500,2016-04-18 12:09:28
2016-04-18 12:18:40,INT-14525/16,Kontrola handlu na ul. Ołaswkiej bez zezwolenia - Park Kulturowy,HANDEL,OŁAWSKA /,MANDAT,100,2016-04-18 12:18:51
2016-04-18 12:26:53,INT-14527/16,kontrola parkowania pojazdów za znakiem B-36,NIEPRAWIDŁOWE PARKOWANIE,GRABISZYŃSKA /,,0,2016-04-18 12:27:12
2016-04-18 12:26:53,INT-14527/16,kontrola parkowania pojazdów za znakiem B-36,NIEPRAWIDŁOWE PARKOWANIE,GRABISZYŃSKA /,,100,2016-04-18 12:27:12
2016-04-18 12:30:02,INT-14529/16,"SKRZYŻOWANIE Z UL. ESTOŃSKĄ W OKOLICY PRZEJŚCIA DLA PIESZYCH , HANDEL KWIATAMI Z BUSA. ",HANDEL,STRZEGOMSKA /,,500,2016-04-18 13:04:59
2016-04-18 12:31:05,INT-14528/16,kontrola parkowania za znakiem B-36,NIEPRAWIDŁOWE PARKOWANIE,ŚW.ANTONIEGO /,,0,2016-04-18 12:31:17
2016-04-18 12:31:05,INT-14528/16,kontrola parkowania za znakiem B-36,NIEPRAWIDŁOWE PARKOWANIE,ŚW.ANTONIEGO /,,100,2016-04-18 12:31:17
2016-04-18 13:02:28,INT-14535/16,Kontrola parkowania pojazdów na pasie wyłączonym z ruchu oraz na chodniku niezgodnie z oznakowaniem,NIEPRAWIDŁOWE PARKOWANIE,PLAC MUZEALNY /,WEZWANIE,100,2016-04-18 13:02:50
2016-04-18 13:02:28,INT-14535/16,Kontrola parkowania pojazdów na pasie wyłączonym z ruchu oraz na chodniku niezgodnie z oznakowaniem,NIEPRAWIDŁOWE PARKOWANIE,PLAC MUZEALNY /,WEZWANIE,0,2016-04-18 13:02:50
2016-04-18 13:07:05,INT-14538/16,Kontrola parkowania pojazdów na skrzyżowaniu,NIEPRAWIDŁOWE PARKOWANIE,ŚWIEBODZKA /,WEZWANIE,0,2016-04-18 13:07:14
2016-04-18 13:07:29,INT-14539/16,handel na terenie gminnym gminy wrocław art.60.3,HANDEL,SKARBOWCÓW /,MANDAT,50,2016-04-18 13:12:35
2016-04-18 13:15:44,INT-14542/16,PARKOWANIE W STREFIE ZAMIESZKANIA POZA MIEJSCEM WYZNACZONYM POJAZDU MARKI VW. ,NIEPRAWIDŁOWE PARKOWANIE,PRZYJAŹNI 6/,,0,2016-04-18 16:06:09
2016-04-18 13:23:39,INT-14546/16,Kontrola parkowania za znakiem b-36 t24,NIEPRAWIDŁOWE PARKOWANIE,SZEWSKA /,MANDAT,100,2016-04-18 13:23:48
2016-04-18 13:25:49,INT-14551/16,"WPŁYNEŁO ZGŁOSZENIE TELEFONICZNE DOTYCZĄCE UL.BARWINKOWEJ 1, 1A OSOBA ZGŁASZAJĄCA TWIERDZI, ŻE WŁAŚCICIELE NIE OPRÓZNIAJĄ SZAMBA.",PORZĄDKOWA,BARWINKOWA 1A/,MANDAT,100,2016-05-04 08:43:30
2016-04-18 13:45:28,INT-14557/16,WJAZD OD UL. JAGIELLOŃCZYKA ZABLOKOWANY WJAZD NA TEREN BOISKA SP NR 108 PRZEZ POJAZD OSOBOPWY PARKUJĄCY NA BRAMIE WJAZDOWEJ. ZGŁASZAJĄCA BĘDZIE DZWONIĆ JAK ZMIENI SIĘ SYTUACJA.GODZ 16.40 PONOWNA PROŚBA O INT. W/W ZGŁ PONIEWAŻ POLICJANCI BYLI ALE NIE PODJELI ZADNYCH CZYNNOŚCI,NIEPRAWIDŁOWE PARKOWANIE,CHROBREGO /,MANDAT,100,2016-04-18 23:23:59
2016-04-18 13:50:51,INT-14558/16,PARKOWANIE POJAZDÓW PRZY WYSEPKACH UTRUDNIONY RUCH AUTOBUSÓW MPK,NIEPRAWIDŁOWE PARKOWANIE,ZIELIŃSKIEGO /,,150,2016-04-18 14:34:47
2016-04-18 13:50:51,INT-14558/16,PARKOWANIE POJAZDÓW PRZY WYSEPKACH UTRUDNIONY RUCH AUTOBUSÓW MPK,NIEPRAWIDŁOWE PARKOWANIE,ZIELIŃSKIEGO /,,100,2016-04-18 14:34:47
2016-04-18 15:25:46,INT-14570/16,parkowanie pojazdu w miejscu obowiązywania znaku B-36 i T-24 obowiązuje w dniu 18.04.2016r na potrzeby wykonywania oznakowania poziomego,NIEPRAWIDŁOWE PARKOWANIE,STALOWA /,LAWETA,100,2016-04-18 15:25:46
2016-04-18 15:31:48,INT-14571/16,PARKOWA\NIE POJAZDÓW  BEZ UPRAWNIEN NA POSTOJU TAXI.,NIEPRAWIDŁOWE PARKOWANIE,RUSKA /,,0,2016-04-18 16:17:38
2016-04-18 15:53:15,INT-14574/16,"PATROL Z RYNKU 10-102 (ZAWILLA, KRUSZEWSKI)  PRZYJĄŁ ZGŁOSZENIE OD MIESZKAŃCA PARKOWANIE POJAZDÓW W STREFIE ZAMIESZKANIA POZA MIEJSCAMI WYZNACZONYMI.",NIEPRAWIDŁOWE PARKOWANIE,PARTYNICKA 1-7/,,0,2016-04-18 18:34:34
2016-04-18 16:57:30,INT-14583/16,ikontrola ruchu pojazdów za B-1,BEZPIECZEŃSTWO W KOMUNIKACJI,SZEWSKA /,MANDAT,50,2016-04-18 16:57:30
2016-04-18 17:03:00,INT-14584/16,A UL. PUSZCZYKOWSKA. PARKOWANIE 3 POJAZDÓW W STREFIE ZAMIESZKANIA POZA MIEJSCAMI WYZNACZONYMI.,NIEPRAWIDŁOWE PARKOWANIE,DŁUGOPOLSKA /,,100,2016-04-18 19:56:37
2016-04-18 17:10:33,INT-14588/16,Parkowanie na powierzchni wyłączonej z ruchu p-21,NIEPRAWIDŁOWE PARKOWANIE,REJTANA /,,100,2016-04-18 17:10:44
2016-04-18 18:12:42,INT-14595/16,Zgłoszenie mieszkańca w sprawie nieprawidłowego parkowania przy ul. Uniwersyteckiej,NIEPRAWIDŁOWE PARKOWANIE,UNIWERSYTECKA /,WEZWANIE,0,2016-04-18 18:23:17
2016-04-18 18:13:40,INT-14597/16,"ZA PĘTLĄ TRAMWAJOWOM DO POJAZDU MARKI FORD DW768SA, NA KTÓRY BYŁA ZAŁOŻONA BLKADA ZGŁOSIŁA SIĘ KIERUJĄCA LAT 33, NIE POSIADA PRZY SOBIE UPRAWNIEŃ DO KIEROWANIA. NA MIEJSCE WEZWANO PATROL POLICJI. GODZ 18.10 NA MIEJSCU PATROL POLICJI B117 POTWIERDZIŁ W/W POSIADA UPRAWNIENIA. UKARANA MKK/100 ",NIEPRAWIDŁOWE PARKOWANIE,SNYCERSKA /,,100,2016-04-18 18:47:57
2016-04-18 18:16:20,INT-14594/16,Parkowanie za B-36,BLOKADA,ŻYCZLIWA /,,100,2016-04-18 18:16:26
2016-04-18 18:16:20,INT-14594/16,Parkowanie za B-36,BLOKADA,ŻYCZLIWA /,,0,2016-04-18 18:16:26
2016-04-18 18:46:13,INT-14602/16,"PARKOWANIE NA CHODNIKU BRAK 1,5M PRZEJŚCIA- SZKOCKA/NORWESKA PARKOWANIE NA SKRZYŻOWANIU",NIEPRAWIDŁOWE PARKOWANIE,NORWESKA 13-15/,,100,2016-04-18 21:33:21
2016-04-18 18:48:44,INT-14603/16,Parkowanie za b36,BLOKADA,WIELKA /,,100,2016-04-18 18:48:58
2016-04-18 18:53:32,INT-14604/16,Parkowanie nie oprzy krawędzi jezdni.,BLOKADA,WIELKA /,,0,2016-04-18 18:54:00
2016-04-18 18:57:35,INT-14605/16,PARKOWANIE POJAZDÓW OSOBOWYCH NA KOPERTACH PRZEZNACZONYCH DLA AUTOBUSÓW,NIEPRAWIDŁOWE PARKOWANIE,OFIAR OŚWIĘCIMSKICH 28/,,100,2016-04-18 19:21:29
2016-04-18 19:00:21,INT-14607/16,Parkowanie za B-36,BLOKADA,WŁODKOWICA /,,0,2016-04-18 19:01:13
2016-04-18 19:06:30,INT-14608/16,Parkowanie za D-40 w miejscu niewyznaczonym,NIEPRAWIDŁOWE PARKOWANIE,FREDRY /,,100,2016-04-18 19:06:54
2016-04-18 19:46:46,INT-14615/16,Niszczenie zieleni,NISZCZENIE ZIELENI,WAŁBRZYSKA /,MANDAT,500,2016-05-12 06:56:00
2016-04-18 19:53:33,INT-14616/16,wypaklanie odpadów,"WYPALANIE, OGNISKO",WIADUKTOWA /,MANDAT,100,2016-05-16 19:32:45
2016-04-18 20:07:27,INT-14619/16,pojazd zaparkowany na B-36 i utrudnia ruch na chodniku.,NIEPRAWIDŁOWE PARKOWANIE,OLSZEWSKIEGO 93/,WEZWANIE,0,2016-04-18 20:46:50
2016-04-18 22:53:59,INT-14634/16,Pojazd na B-36.,NIEPRAWIDŁOWE PARKOWANIE,OGÓRKOWA /,,0,2016-04-18 23:39:37
2016-04-18 23:41:10,INT-14645/16,"Postój na chodniku brak 1,5m przejścia dla pieszych",NIEPRAWIDŁOWE PARKOWANIE,SNYCERSKA /,,0,2016-04-18 23:41:10
2016-04-18 23:41:10,INT-14645/16,"Postój na chodniku brak 1,5m przejścia dla pieszych",NIEPRAWIDŁOWE PARKOWANIE,SNYCERSKA /,,100,2016-04-18 23:41:10
2016-04-18 23:52:17,INT-14646/16,"Postój na chodniku brak 1,5m przejścia dla pieszych",NIEPRAWIDŁOWE PARKOWANIE,SNYCERSKA /,POUCZENIE,0,2016-04-18 23:52:17
2016-04-19 06:39:13,INT-14663/16,Pojazdy zaparkowane na całej szerokości chodnika.,NIEPRAWIDŁOWE PARKOWANIE,DUBOIS 33-35/,,0,2016-04-20 00:35:00
2016-04-19 06:49:18,INT-14664/16,Parkowanie za D-40 w miejscu niewyznaczonym,BLOKADA,ŁACIARSKA /,,0,2016-04-19 06:49:25
2016-04-19 08:37:59,INT-14684/16,"a ul. Zielińskiego przy szpitalu parkowanie na chodniku, brak 1,5m + niszczenie zieleni",NIEPRAWIDŁOWE PARKOWANIE,ZAPOROSKA /,,0,2016-04-19 10:01:05
2016-04-19 08:37:59,INT-14684/16,"a ul. Zielińskiego przy szpitalu parkowanie na chodniku, brak 1,5m + niszczenie zieleni",NIEPRAWIDŁOWE PARKOWANIE,ZAPOROSKA /,,100,2016-04-19 10:01:05
2016-04-19 08:37:59,INT-14684/16,"a ul. Zielińskiego przy szpitalu parkowanie na chodniku, brak 1,5m + niszczenie zieleni",NIEPRAWIDŁOWE PARKOWANIE,ZAPOROSKA /,,50,2016-04-19 10:01:05
2016-04-19 09:39:38,INT-14694/16,między Astrą a przystankiem nielegalny handel ,HANDEL,LOTNICZA 89/,,0,2016-04-19 10:17:05
2016-04-19 09:47:06,INT-14696/16,nielegalny handel w przejściu ,HANDEL,STRZEGOMSKI /,MANDAT,50,2016-04-19 12:02:23
2016-04-19 09:53:21,INT-14699/16,Kontrola nielegalnego handlu w Parku Kulturowym,HANDEL,PLAC DOMINIKAŃSKI /,MANDAT,100,2016-04-19 09:56:51
2016-04-19 10:05:25,INT-14702/16,"A GAJOWA POSTÓ POJAZDÓW NA TRAWNIKU, NISZCZENIE ROŚLINNOŚCI",NISZCZENIE ZIELENI,DAWIDA /,,50,2016-04-19 11:19:09
2016-04-19 10:05:25,INT-14702/16,"A GAJOWA POSTÓ POJAZDÓW NA TRAWNIKU, NISZCZENIE ROŚLINNOŚCI",NISZCZENIE ZIELENI,DAWIDA /,,0,2016-04-19 11:19:09
2016-04-19 10:17:56,INT-14705/16,POSTÓJ POJAZDY NA CAŁEJ SZEROKOŚCI CHODNIKA VW ,NIEPRAWIDŁOWE PARKOWANIE,SIENKIEWICZA 26-28/,,100,2016-04-19 13:36:20
2016-04-19 10:18:17,INT-14706/16,nieprawidłowe parkowanie pojazdów. ,NIEPRAWIDŁOWE PARKOWANIE,PL.MUZEALNY 3-15/,,0,2016-04-19 10:23:01
2016-04-19 10:20:35,INT-14707/16,"DO UL. JEMIOŁOWEJ HANDEL , NIE MA MOŻLIWOŚCI SWOBOTNEGO PRZEJŚCIA.Ponowne zgłoszenie ",HANDEL,GROCHOWA 2/,,50,2016-04-19 11:52:14
2016-04-19 10:33:36,INT-14712/16,"pojazd dostawczy zaparkowany na jezdni, blokuje przejazd. Ponowne zgłoszenie w ",NIEPRAWIDŁOWE PARKOWANIE,NA SZAŃCACH 11/,,100,2016-04-20 00:18:27
2016-04-19 10:45:31,INT-14717/16,WJAZD OD LEGNICKIEJ-ZABLOKOWANY PAS RUCHU,NIEPRAWIDŁOWE PARKOWANIE,BIAŁOWIESKA /,,0,2016-04-19 11:55:24
2016-04-19 10:45:31,INT-14717/16,WJAZD OD LEGNICKIEJ-ZABLOKOWANY PAS RUCHU,NIEPRAWIDŁOWE PARKOWANIE,BIAŁOWIESKA /,,100,2016-04-19 11:55:24
2016-04-19 10:45:31,INT-14717/16,WJAZD OD LEGNICKIEJ-ZABLOKOWANY PAS RUCHU,NIEPRAWIDŁOWE PARKOWANIE,BIAŁOWIESKA /,,50,2016-04-19 11:55:24
2016-04-19 10:46:19,INT-14716/16,koło szpitala parkowanie na postoju taxi + niszczenie zieleni,NIEPRAWIDŁOWE PARKOWANIE,WEIGLA /,,0,2016-04-19 13:57:32
2016-04-19 10:46:19,INT-14716/16,koło szpitala parkowanie na postoju taxi + niszczenie zieleni,NIEPRAWIDŁOWE PARKOWANIE,WEIGLA /,,100,2016-04-19 13:57:32
2016-04-19 10:56:37,INT-14720/16,"NA PODWÓRZU MYCIE POJAZDU, ZGŁASZAJĄCA POD TELEFONEM, NA MIEJSCU",PORZĄDKOWA,ADAMCZEWSKICH 2/,,200,2016-04-19 11:04:33
2016-04-19 11:02:07,INT-14723/16,"A UL. ESTOŃSKA HANDEL KWIATY, RYBY, UBRANIA.....",HANDEL,STRZEGOMSKA /,MANDAT,100,2016-04-19 12:41:54
2016-04-19 11:04:22,INT-14724/16,Parkowanie za B-36 i nie przy krawędzi jezdni,BLOKADA,RONDO HAVLA /,,0,2016-04-19 11:04:28
2016-04-19 11:07:16,INT-14726/16,Parkowanie za B-36,BLOKADA,CIESZYŃSKIEGO /,,100,2016-04-19 11:08:05
2016-04-19 12:11:27,INT-14732/16,14 POJAZDÓW ZA B-36+T-24,NIEPRAWIDŁOWE PARKOWANIE,DUŃSKA 9/,,100,2016-04-19 19:11:50
2016-04-19 12:19:43,INT-14737/16,Postój na miejscach dla osób niepełnosprawnych bez zezwoleń wg.zgłaszającego- przed szpitalem.,NIEPRAWIDŁOWE PARKOWANIE,WEIGLA /,,0,2016-04-19 13:58:09
2016-04-19 12:19:43,INT-14737/16,Postój na miejscach dla osób niepełnosprawnych bez zezwoleń wg.zgłaszającego- przed szpitalem.,NIEPRAWIDŁOWE PARKOWANIE,WEIGLA /,,500,2016-04-19 13:58:09
2016-04-19 12:39:27,INT-14740/16,"POSTÓJ ZA D-40. + SKRZYŻOWANIE MAKUSZYŃSKIEGO A CHRZANOWSKIEGO, FILOMATÓW A CHRZANOWSKIEGO I MAKUSZYŃSKIEGO A FILOMATÓW- CHODNIK, BRAK 1,5 M SZER CHODNIKA",NIEPRAWIDŁOWE PARKOWANIE,CHRZANOWSKIEGO 16-18/,,100,2016-04-20 00:15:41
2016-04-19 12:43:03,INT-14743/16,Patrol w czasie kontroli ujawnił kierującego bez uprawnień.,BEZPIECZEŃSTWO W KOMUNIKACJI,SZEWSKA 68/,,500,2016-04-19 13:35:05
2016-04-19 12:46:34,INT-14742/16,Parkowanie za B-36 i 10 m od przejscia dla pieszych,BLOKADA,BERNARDYŃSKA /,,100,2016-04-19 12:46:44
2016-04-19 13:11:25,INT-14755/16,A ZAOLZIAŃSKA 5 POJAZDÓW ZA B-36,NIEPRAWIDŁOWE PARKOWANIE,POWSTAŃCÓW ŚLĄSKICH /,,0,2016-04-19 15:34:03
2016-04-19 13:11:25,INT-14755/16,A ZAOLZIAŃSKA 5 POJAZDÓW ZA B-36,NIEPRAWIDŁOWE PARKOWANIE,POWSTAŃCÓW ŚLĄSKICH /,,100,2016-04-19 15:34:03
2016-04-19 13:21:24,INT-14761/16,A NOWY ŚWIAT 2 POJAZDY NA TRAWNIKU NISZCZĄ ROŚLINNOŚC. G. 16.49 PONOWNE ZGŁOSZENIE - POJZADY NADAL ZAPARKOWANE NA TRAWNIKU,NISZCZENIE ZIELENI,CIESZYŃSKIEGO /,,100,2016-04-19 18:27:19
2016-04-19 13:26:36,INT-14764/16,kontrola handlu punktu w kturym sprzedawane sa kwiaty,HANDEL,SEMAFOROWA /,MANDAT,50,2016-04-19 13:26:48
2016-04-19 13:29:24,INT-14766/16,mezczyzna spozywa piwo na ławce,SPOŻYWANIE ALKOHOLU,BIRMAŃSKA /,MANDAT,100,2016-04-19 13:32:35
2016-04-19 13:38:09,INT-14770/16,"JEZDNIA I KANAŁY ŚCIEKOWE ZANIECZYSZCZANE PRZEZ BUDOWĘ STEROPIANEM, FOLIĄ",PORZĄDKOWA,DĄBROWSKIEGO 40/,MANDAT,100,2016-05-12 06:57:30
2016-04-19 13:44:23,INT-14772/16,"A BIAŁOSKÓRNICZA NA DR DLA ROWERÓW 1 POJAZD, NA WYS. HOTELU SOFITEL 3 POJAZDY ZA B-36",NIEPRAWIDŁOWE PARKOWANIE,MIKOŁAJA /,,0,2016-04-19 14:54:43
2016-04-19 13:50:01,INT-14773/16,A DOBRA POJAZDY ZA B-36,NIEPRAWIDŁOWE PARKOWANIE,ZIEMOWITA /,,0,2016-04-19 14:45:48
2016-04-19 13:50:01,INT-14773/16,A DOBRA POJAZDY ZA B-36,NIEPRAWIDŁOWE PARKOWANIE,ZIEMOWITA /,,100,2016-04-19 14:45:48
2016-04-19 13:52:31,INT-14774/16,Kontrola nielegalnego handlu ul. Oławska,HANDEL,OŁAWSKA /,MANDAT,50,2016-04-19 13:53:09
2016-04-19 14:00:36,INT-14775/16,Kontrola za znakiem B-1,BEZPIECZEŃSTWO W KOMUNIKACJI,SZEWSKA 68/,MANDAT,50,2016-04-19 14:02:10
2016-04-19 15:47:52,INT-14789/16,Handel kwiatami przy księgarni.,HANDEL,PLAC LEGIONÓW /,,50,2016-04-19 20:04:10
2016-04-19 15:54:41,INT-14791/16,Kontrola handlu na terenie Parku Kulturowego,HANDEL,OŁAWSKA /,MANDAT,50,2016-04-19 15:56:49
2016-04-19 16:23:43,INT-14795/16,ZABLOKOWANY WJAZD NA POSESJĘ ( DZWONIĆ NA DOMOFON).,NIEPRAWIDŁOWE PARKOWANIE,JARZĘBINOWA 15A/,,100,2016-04-19 18:52:10
2016-04-19 16:23:47,INT-14796/16,Sąsiad z posesji Promień 11podrzuca obcinane gałęzie z ogródka pod kontenery na śmieci.,PORZĄDKOWA,PROMIEŃ 11/,BEZ UWAG,0,2016-05-24 18:54:30
2016-04-19 16:40:52,INT-14798/16,LUZEM WYRZUCANE Z OGRÓDKA ODPADY ZIELONE (GAŁĘZIE) DO KONTENERÓW NA ODPADY KOMUNALNE,PORZĄDKOWA,NULLA 4/,MANDAT,300,2016-04-28 07:03:09
2016-04-19 16:59:15,INT-14805/16,między Sienkiewicza a Chemiczną parkowanie na zakazie (pojazdy cieżarowe) ,NIEPRAWIDŁOWE PARKOWANIE,UKRYTA /,,100,2016-04-19 17:30:08
2016-04-19 17:13:30,INT-14816/16,Parkowanie za b-36,NIEPRAWIDŁOWE PARKOWANIE,PRETFICZA /,,0,2016-04-19 17:20:24
2016-04-19 17:13:30,INT-14816/16,Parkowanie za b-36,NIEPRAWIDŁOWE PARKOWANIE,PRETFICZA /,,100,2016-04-19 17:20:24
2016-04-19 17:20:01,INT-14818/16,ZA HALĄ ORBITA JADĄC W STRONĘ PARKU  PATRZĄC NA ZACHÓD UNOSI SIĘ   DYM OSOBA ZGŁASZAJACA NIE WIE DOKŁADNIE NA KTÓREJ POSESJI SPALANE SA ODPADY. ,"WYPALANIE, OGNISKO",WEJHEROWSKA /,SĄD,0,2016-05-16 19:31:26
2016-04-19 17:33:56,INT-14819/16,Parkowanie za b-36,NIEPRAWIDŁOWE PARKOWANIE,PL. ŚW. MACIEJA /,,0,2016-04-19 17:34:04
2016-04-19 17:39:30,INT-14820/16,parkowanie za b-36,NIEPRAWIDŁOWE PARKOWANIE,POMORSKA /,,0,2016-04-19 17:39:35
2016-04-19 17:39:30,INT-14820/16,parkowanie za b-36,NIEPRAWIDŁOWE PARKOWANIE,POMORSKA /,,100,2016-04-19 17:39:35
2016-04-19 17:46:02,INT-14824/16,Parkowanie za b-36.,NIEPRAWIDŁOWE PARKOWANIE,CYBULSKIEGO /,,100,2016-04-19 17:46:06
2016-04-19 17:55:23,INT-14825/16,"WJAZD POJAZDÓW ZA B-1, POSTÓJ NA TRAWNIKU-NISZCZENIE ROŚLINNOŚCI, NA WYS NR 58 NA SKARPIE Z ROŚLINNOŚCIĄ PARKOWANIE-NISZCZENIE ROŚLINNOŚCI",NISZCZENIE ZIELENI,LUBUSKA 54/,,50,2016-04-19 18:56:48
2016-04-19 17:55:23,INT-14825/16,"WJAZD POJAZDÓW ZA B-1, POSTÓJ NA TRAWNIKU-NISZCZENIE ROŚLINNOŚCI, NA WYS NR 58 NA SKARPIE Z ROŚLINNOŚCIĄ PARKOWANIE-NISZCZENIE ROŚLINNOŚCI",NISZCZENIE ZIELENI,LUBUSKA 54/,,0,2016-04-19 18:56:48
2016-04-19 18:50:56,INT-14837/16,Pjazd  parkuje na trawniku niszcząc zieleń.,NIEPRAWIDŁOWE PARKOWANIE,MIELECKA 28/,,0,2016-04-20 00:46:00
2016-04-19 18:55:28,INT-14838/16,Parkowanie na postoju taxi bez uprawnień.,NIEPRAWIDŁOWE PARKOWANIE,KOMANDORSKA /,,0,2016-04-19 18:55:31
2016-04-19 18:55:28,INT-14838/16,Parkowanie na postoju taxi bez uprawnień.,NIEPRAWIDŁOWE PARKOWANIE,KOMANDORSKA /,,100,2016-04-19 18:55:31
2016-04-19 19:04:43,INT-14842/16,Parkowanie za b-1 i d-40.,NIEPRAWIDŁOWE PARKOWANIE,PLAC ZAMKOWY /,,0,2016-04-19 19:05:02
2016-04-19 19:41:16,INT-14847/16,POSTÓJ POJAZDÓW W STREFIE ZAMIESZKANIA W MIEJSCU INNYM NIŻ WYZNACZONE,NIEPRAWIDŁOWE PARKOWANIE,ZAUŁEK WOLSKI /,,100,2016-04-19 21:55:21
2016-04-19 19:49:56,INT-14848/16,Niestosowanie się do znaku drogowego B-36 na jezdni i chodniku przez pojazd Audi ,NIEPRAWIDŁOWE PARKOWANIE,KRZYCKA 92/B-C-D,,0,2016-04-19 19:55:33
2016-04-19 20:03:55,INT-14892/16,A ŚLĘŻNA PARKOWANIE JEDNEGO POJAZDU ZA B-36,NIEPRAWIDŁOWE PARKOWANIE,JAWOROWA /,,0,2016-04-19 21:24:47
2016-04-19 22:46:00,INT-14860/16,"ZA BLOKIEM POJAZD MARKI RENAULT CLIO ZAPARKOWAŁ NA ZIELEŃCU. WEDŁUG ZGŁASZJĄCEGO PRZEJECHAŁ PRZEZ CHODNIK, TRAWNIK ",NISZCZENIE ZIELENI,ZIELONOGÓRSKA 2/,,50,2016-04-20 01:22:51
2016-04-19 22:49:02,INT-14861/16,PARKOWANIE 1 POJAZDU NA POSTOJU TAXI BEZ UPRAWNIEŃ.,NIEPRAWIDŁOWE PARKOWANIE,ŁACIARSKA /,,0,2016-04-19 23:13:32
2016-04-20 05:34:59,INT-14868/16,parkowanie za b-36,BLOKADA,ŚW.ANTONIEGO /,,100,2016-04-20 05:35:07
2016-04-20 05:34:59,INT-14868/16,parkowanie za b-36,BLOKADA,ŚW.ANTONIEGO /,,0,2016-04-20 05:35:07
2016-04-20 07:24:07,INT-14877/16,PARKOWANIE POJAZDÓW POWYŻEJ ZA B-35 DO 15MIN PRZY PRZEDSZKOLU,NIEPRAWIDŁOWE PARKOWANIE,DOBRA 41/,,0,2016-04-20 10:32:05
2016-04-20 07:24:07,INT-14877/16,PARKOWANIE POJAZDÓW POWYŻEJ ZA B-35 DO 15MIN PRZY PRZEDSZKOLU,NIEPRAWIDŁOWE PARKOWANIE,DOBRA 41/,,100,2016-04-20 10:32:05
2016-04-20 08:26:23,INT-14880/16,przy przejściu Winogronowym handel kwiatami,HANDEL,OŁAWSKA /,MANDAT,100,2016-04-20 09:06:03
2016-04-20 08:27:16,INT-14881/16,a Świdnicka na hodniku handel kwiatami.,HANDEL,PIŁSUDSKIEGO /,,40,2016-04-20 09:35:33
2016-04-20 08:29:17,INT-14882/16,przy SP 47 parkowanie pojazdów na skrzyżowaniu i bezpośrednio przed przejściem dla pieszych,NIEPRAWIDŁOWE PARKOWANIE,JANUSZOWICKA /,,0,2016-04-20 09:06:29
2016-04-20 09:40:16,INT-14891/16,"A Sądowa, granatowy pojazd na pasach dla pieszych oraz brak 1,5m",NIEPRAWIDŁOWE PARKOWANIE,ŚWIEBODZKA /,,0,2016-04-20 12:03:24
2016-04-20 09:50:30,INT-14893/16,"przy Sky Tower parkowanie pojazdów na pasie ruchu, utrudnianie przejazdu",NIEPRAWIDŁOWE PARKOWANIE,GWIAŹDZISTA /,,100,2016-04-20 11:55:49
2016-04-20 10:10:21,INT-14900/16,Kontrola handlu na terenie Gminy bez zezwolenia - Park Kulturowy,HANDEL,OŁAWSKA /,MANDAT,200,2016-04-20 10:10:32
2016-04-20 10:10:21,INT-14900/16,Kontrola handlu na terenie Gminy bez zezwolenia - Park Kulturowy,HANDEL,OŁAWSKA /,MANDAT,100,2016-04-20 10:10:32
2016-04-20 10:10:45,INT-14899/16,parkowanie pojazdów za znakiem zakazu,NIEPRAWIDŁOWE PARKOWANIE,MARCINKOWSKIEGO /,,0,2016-04-20 11:43:53
2016-04-20 10:24:21,INT-14901/16,zablokowany wyjazd z NIK,NIEPRAWIDŁOWE PARKOWANIE,LELEWELA 2/,MANDAT,100,2016-04-20 10:57:01
2016-04-20 10:59:41,INT-14905/16,przy szkole stoisko handlowe blokuje przejście chodnikiem,HANDEL,ZEMSKA /,MANDAT,100,2016-04-20 12:43:18
2016-04-20 11:35:56,INT-14911/16,Honda DW122EX na chodniku (pozost ok.20-30cm) oraz za B-36 + Kia za B-36.,NIEPRAWIDŁOWE PARKOWANIE,CIESZYŃSKIEGO 13/,,100,2016-04-20 16:51:47
2016-04-20 11:58:47,INT-14915/16,Parkowanie na postoju TAXI,BEZPIECZEŃSTWO W KOMUNIKACJI,MIELECKA /,,100,2016-04-20 11:59:06
2016-04-20 12:00:38,INT-14916/16,Parkowanie na P21,NIEPRAWIDŁOWE PARKOWANIE,WYBRZEŻE WYSPIAŃSKIEGO /,,0,2016-04-20 12:01:09
2016-04-20 12:00:38,INT-14916/16,Parkowanie na P21,NIEPRAWIDŁOWE PARKOWANIE,WYBRZEŻE WYSPIAŃSKIEGO /,,100,2016-04-20 12:01:09
2016-04-20 12:05:35,INT-14918/16,a pl.Muzealny parkowanie na skrzyżowaniu       ,NIEPRAWIDŁOWE PARKOWANIE,ŚWIEBODZKA /,,0,2016-04-20 12:05:59
2016-04-20 12:08:31,INT-14919/16,Parkowanie na miejscu dla osoby niepełnosprawnej bez uprawnień,NIEPRAWIDŁOWE PARKOWANIE,STALOWA /,,0,2016-04-20 12:08:52
2016-04-20 12:10:29,INT-14920/16,"Gęsty, duszący dym z pobliskich kominów w pobliżu ROD ""Poświętne"". Zgłaszajacy z działki nr 340 wykonał zdjęcia. Prosi o kontakt z patrolem. Zgłaszał problem już wcześniej (int.13593).","WYPALANIE, OGNISKO",LEKARSKA /,MANDAT,150,2016-04-28 07:07:49
2016-04-20 12:15:10,INT-14921/16,nieprawidłowe parkowanie pojazdu marki Skoda Kombi przy przejściu dla pieszych.,NIEPRAWIDŁOWE PARKOWANIE,WOLSKA /,,0,2016-04-20 12:17:05
2016-04-20 12:26:33,INT-14922/16,a Estońska nielegalny handel - kwiaty,HANDEL,STRZEGOMSKA /,MANDAT,100,2016-04-20 15:08:21
2016-04-20 12:28:42,INT-14923/16,pojazd bus blokuje przejście chodnikiem - pojazd należy do ekipy remontującej kamienice,NIEPRAWIDŁOWE PARKOWANIE,PLAC STRZELECKI 18/,,100,2016-04-21 00:17:22
2016-04-20 12:57:54,INT-14936/16,kontrola parkowania za znakiem B-36+T-24 oraz na skrzyżowaniu,NIEPRAWIDŁOWE PARKOWANIE,ŚWIEBODZKA /,,0,2016-04-20 12:57:57
2016-04-20 12:57:54,INT-14936/16,kontrola parkowania za znakiem B-36+T-24 oraz na skrzyżowaniu,NIEPRAWIDŁOWE PARKOWANIE,ŚWIEBODZKA /,,100,2016-04-20 12:57:57
2016-04-20 13:05:28,INT-14948/16,"A Laotańska, VW Passat  blokuje przejazd karetce.",NIEPRAWIDŁOWE PARKOWANIE,WĘGIERSKA /,,0,2016-04-20 13:37:26
2016-04-20 13:10:40,INT-14947/16,Kontrola parkowania pojazdów w związku z pismem,NIEPRAWIDŁOWE PARKOWANIE,PL.MUZEALNY /,WEZWANIE,100,2016-04-20 13:11:08
2016-04-20 13:10:40,INT-14947/16,Kontrola parkowania pojazdów w związku z pismem,NIEPRAWIDŁOWE PARKOWANIE,PL.MUZEALNY /,WEZWANIE,0,2016-04-20 13:11:08
2016-04-20 13:11:19,INT-14945/16,Kontrola za znakiem B-1,BEZPIECZEŃSTWO W KOMUNIKACJI,SZEWSKA /,MANDAT,50,2016-04-20 13:11:45
2016-04-20 13:11:34,INT-14944/16,mężczyzna spozywa alkohol na ulicy,SPOŻYWANIE ALKOHOLU,SZTABOWA /,MANDAT,100,2016-04-20 13:11:51
2016-04-20 13:13:21,INT-14950/16,Kontrola parkowania za znakiem B-36,NIEPRAWIDŁOWE PARKOWANIE,WIELKA /,MANDAT,100,2016-04-20 13:13:40
2016-04-20 13:16:47,INT-14949/16,kontrola parkowania za B-36,BLOKADA,ZAPOROSKA /,MANDAT,100,2016-04-20 13:17:09
2016-04-20 13:18:03,INT-14951/16,Parkowanie na miejscu dla inwalidy bez uprawnień,NIEPRAWIDŁOWE PARKOWANIE,DOBRZYŃSKA /,,500,2016-04-20 13:18:13
2016-04-20 13:29:55,INT-14955/16,Kontrola parkowania za znakiem b36,NIEPRAWIDŁOWE PARKOWANIE,GWIAŹDZISTA /,MANDAT,100,2016-04-20 13:30:23
2016-04-20 13:31:14,INT-14956/16,zablokowany wyjazd z miejsca parkingowego przez Fiata Panda,NIEPRAWIDŁOWE PARKOWANIE,PLAC POWSTAŃCÓW WARSZAWY 1/,,0,2016-04-20 15:33:06
2016-04-20 13:33:21,INT-14960/16,Kontrola za znakiem b36 +t24,NIEPRAWIDŁOWE PARKOWANIE,SZEWSKA /,MANDAT,100,2016-04-20 13:38:49
2016-04-20 13:48:04,INT-14962/16,przy kwiaciarni parkowanie pojazdów za znakiem zakazu,NIEPRAWIDŁOWE PARKOWANIE,GWARNA /,,0,2016-04-20 14:45:37
2016-04-20 13:54:45,INT-14965/16,4 pojazdy za B-36 + T-24.,NIEPRAWIDŁOWE PARKOWANIE,PLAC GRUNWALDZKI 3/,LAWETA,100,2016-04-20 16:19:03
2016-04-20 14:05:17,INT-14968/16,"Na terenie parkingu osiedlowego (pierwszy wjazd w prawo za pomarańczowym budynkiem), na wysokości budynku Białowieska 30, ciemnozielony Peugeot 406 niszczy roślinność parkując na trawniku.",NIEPRAWIDŁOWE PARKOWANIE,RYSIA /,WEZWANIE,100,2016-04-20 14:47:25
2016-04-20 14:05:17,INT-14968/16,"Na terenie parkingu osiedlowego (pierwszy wjazd w prawo za pomarańczowym budynkiem), na wysokości budynku Białowieska 30, ciemnozielony Peugeot 406 niszczy roślinność parkując na trawniku.",NIEPRAWIDŁOWE PARKOWANIE,RYSIA /,WEZWANIE,0,2016-04-20 14:47:25
2016-04-20 15:07:45,INT-14974/16,Kontrola handlu na ul. Oławskiej,HANDEL,OŁAWSKA /,MANDAT,50,2016-04-20 15:09:42
2016-04-20 15:10:35,INT-14975/16,Parkowanie za B36 i T24,NIEPRAWIDŁOWE PARKOWANIE,POWSTAŃCÓW ŚLĄSKICH 140/,MANDAT,100,2016-04-20 15:12:26
2016-04-20 15:12:50,INT-14976/16,Handel na terenie Parku Kulturowego,HANDEL,KAZIMIERZA WIELKIEGO /,MANDAT,100,2016-04-20 15:15:25
2016-04-20 15:35:56,INT-14978/16,parkowanie za B-36 i T-24,NIEPRAWIDŁOWE PARKOWANIE,KOMANDORSKA /,,100,2016-04-20 15:36:25
2016-04-20 15:42:33,INT-14980/16,parkowanie na miejscu dla inwalidy bez uprawnień,NIEPRAWIDŁOWE PARKOWANIE,STRZEGOMSKA 6/,MANDAT,500,2016-04-20 15:42:50
2016-04-20 15:56:06,INT-14982/16,"Pojazdy za zakazem, wzdłuż przedszkola.",NIEPRAWIDŁOWE PARKOWANIE,KAZNODZIEJSKA /,,0,2016-04-20 19:56:11
2016-04-20 15:56:06,INT-14982/16,"Pojazdy za zakazem, wzdłuż przedszkola.",NIEPRAWIDŁOWE PARKOWANIE,KAZNODZIEJSKA /,,100,2016-04-20 19:56:11
2016-04-20 16:48:19,INT-14993/16,Kontrola parkowania pojazdów,NIEPRAWIDŁOWE PARKOWANIE,KRUCZA /,MANDAT,100,2016-04-20 16:52:00
2016-04-20 16:48:19,INT-14993/16,Kontrola parkowania pojazdów,NIEPRAWIDŁOWE PARKOWANIE,KRUCZA /,MANDAT,0,2016-04-20 16:52:00
2016-04-20 17:04:19,INT-14995/16,parkowanie w odległości mniejszej niz 10 metrów od przejścia dla pieszych,BLOKADA,INŻYNIERSKA /,,100,2016-04-20 17:04:30
2016-04-20 17:07:41,INT-14997/16,pomiędzy Stalową a Grochową parkowanie pojazdów na chodniku za pasem zieleni,NIEPRAWIDŁOWE PARKOWANIE,PERECA /,WEZWANIE,100,2016-04-20 18:57:53
2016-04-20 17:07:41,INT-14997/16,pomiędzy Stalową a Grochową parkowanie pojazdów na chodniku za pasem zieleni,NIEPRAWIDŁOWE PARKOWANIE,PERECA /,WEZWANIE,0,2016-04-20 18:57:53
2016-04-20 17:37:05,INT-15001/16,na trawniku zaparkowany pojazd Dacia Duster - niszczy zieleń,NISZCZENIE ZIELENI,KOMOROWSKA 11/,,50,2016-04-20 18:14:37
