2016-03-10 06:30:40,INT-08652/16,parkowanie poj. kol. białego na trawniku przy dawnej wyp. kaset Bevery Hils.DO PONOWNEJ KONTROLU W GODZ. POPOŁUDNIOWYCH.,NIEPRAWIDŁOWE PARKOWANIE,LEGNICKA /,,50,2016-03-10 19:42:11
2016-03-10 06:30:40,INT-08652/16,parkowanie poj. kol. białego na trawniku przy dawnej wyp. kaset Bevery Hils.DO PONOWNEJ KONTROLU W GODZ. POPOŁUDNIOWYCH.,NIEPRAWIDŁOWE PARKOWANIE,LEGNICKA /,,0,2016-03-10 19:42:11
2016-03-10 06:34:41,INT-08654/16,a ul. Damrota parkowanie 2 pojazdów za B36,NIEPRAWIDŁOWE PARKOWANIE,WYSZYŃSKIEGO /,,100,2016-03-10 08:48:37
2016-03-10 06:34:41,INT-08654/16,a ul. Damrota parkowanie 2 pojazdów za B36,NIEPRAWIDŁOWE PARKOWANIE,WYSZYŃSKIEGO /,,0,2016-03-10 08:48:37
2016-03-10 07:33:45,INT-08663/16,Parkowanie za znakiem B36,BLOKADA,ŚW.ANTONIEGO /,,100,2016-03-10 07:34:00
2016-03-10 07:33:45,INT-08663/16,Parkowanie za znakiem B36,BLOKADA,ŚW.ANTONIEGO /,,0,2016-03-10 07:34:00
2016-03-10 07:43:01,INT-08665/16,"parkowanie pojazdu kol. ciemnego na chodniku , blokowanie chodnika",NIEPRAWIDŁOWE PARKOWANIE,NOWOWIEJSKA 108/,MANDAT,100,2016-03-17 00:31:26
2016-03-10 09:18:11,INT-08680/16,"PRZY UL. ZIELIŃSKIEGO ZABLOKOWANY PAS RUCHU, UTRUDNIONY PRZEJAZD ",NIEPRAWIDŁOWE PARKOWANIE,SZCZĘŚLIWA /,OSTRZEŻENIE,0,2016-03-10 09:26:58
2016-03-10 09:26:03,INT-08683/16,a  ul. Dokerska pojazd zielony Bus  zaparkowany na chodniku w obrębie skrzyżowania i za blisko hydrantu.,NIEPRAWIDŁOWE PARKOWANIE,GWARECKA /,OSTRZEŻENIE,0,2016-03-10 09:53:21
2016-03-10 09:37:31,INT-08685/16,"pojazd Opel Astra o zaparkowany na chodniku, blokuje przejście",NIEPRAWIDŁOWE PARKOWANIE,POWSTAŃCÓW ŚLĄSKICH 116/,,0,2016-03-10 10:10:04
2016-03-10 09:42:53,INT-08687/16,"przy wjeździe na ul. Kolistą parkowanie na chodniku, brak 1,5m",NIEPRAWIDŁOWE PARKOWANIE,KOZANOWSKA /,,0,2016-03-10 10:13:17
2016-03-10 09:45:11,INT-08689/16,a ul. Pochyła pojazd marki Mercedes zaparkowany na pasie wyłączonym z ruchu.,NIEPRAWIDŁOWE PARKOWANIE,SZPITALNA /,,0,2016-03-10 10:59:58
2016-03-10 09:55:13,INT-08691/16,na wys. Akademii Ekonomicznej parkowanie na zakazie + trawnik,NIEPRAWIDŁOWE PARKOWANIE,KOMANDORSKA /,,100,2016-03-10 11:22:59
2016-03-10 10:06:06,INT-08695/16,a Jaworska bardzo zanieczyszczone chodniki przez pobliska budowę,PORZĄDKOWA,STRZEGOMSKA 42/,MANDAT,200,2016-03-18 06:29:09
2016-03-10 10:19:47,INT-08699/16,"a Gwiaździsta koło Sky Tower zaparkowany pojazd w obrębie przejścia dla pieszych, utrudnia przejazd MPK  - pojazd marki Pousche ",NIEPRAWIDŁOWE PARKOWANIE,ZIELIŃSKIEGO /,,100,2016-03-10 11:35:20
2016-03-10 10:33:21,INT-08705/16,MIEJSKI KONSERWATOZ ZABYTKÓW PROSI O KONTROLĘ PARKOWANIA POJAZDÓW NA CHODNIKU PRZED MUZEUM NARODOEYM. NA WYREMONTOWANYCH CHODNIKACH ZAPARKOWANE POJAZDY POZA MIEJSCAMI PARKINGOWYMI,NIEPRAWIDŁOWE PARKOWANIE,PURKYNIEGO /,,0,2016-03-10 16:52:54
2016-03-10 10:39:36,INT-08707/16,POJAZDY ZA B-36,NIEPRAWIDŁOWE PARKOWANIE,CYBULSKIEGO 33-39/,MANDAT,100,2016-03-10 23:20:23
2016-03-10 10:39:36,INT-08707/16,POJAZDY ZA B-36,NIEPRAWIDŁOWE PARKOWANIE,CYBULSKIEGO 33-39/,MANDAT,0,2016-03-10 23:20:23
2016-03-10 10:49:00,INT-08710/16,"ZASTAWIONY CHODNIK, BRAK MOŻLIWOŚCI PRZEJŚCIA",NIEPRAWIDŁOWE PARKOWANIE,PIĘKNA 56/,,0,2016-03-10 11:28:03
2016-03-10 11:08:46,INT-08714/16,parkowanie na pasach wyłączonych z ruchu,NIEPRAWIDŁOWE PARKOWANIE,WIELKA 26-28/,OSTRZEŻENIE,0,2016-03-10 12:01:57
2016-03-10 11:31:02,INT-08721/16,"zablokowany wyjazd z bramy, z posesji podwórza i firmy Dekspol",NIEPRAWIDŁOWE PARKOWANIE,GWARNA 21/,,0,2016-03-10 12:34:44
2016-03-10 11:52:13,INT-08728/16,parkowanie za znakiem B36,BLOKADA,GRABISZYŃSKA /,,100,2016-03-10 11:52:31
2016-03-10 11:52:13,INT-08728/16,parkowanie za znakiem B36,BLOKADA,GRABISZYŃSKA /,,0,2016-03-10 11:52:31
2016-03-10 11:53:57,INT-08729/16,Parkowanie na skrzyżowaniu Wiazowa/Lipowa,BLOKADA,WIĄZOWA /,,300,2016-03-10 11:54:14
2016-03-10 11:53:57,INT-08729/16,Parkowanie na skrzyżowaniu Wiazowa/Lipowa,BLOKADA,WIĄZOWA /,,100,2016-03-10 11:54:14
2016-03-10 12:51:11,INT-08748/16,"pojazd zaparkowany na chodniku za B-36+T-24, blokuje przejście ",NIEPRAWIDŁOWE PARKOWANIE,LOTNICZA 147/,MANDAT,100,2016-03-10 15:19:00
2016-03-10 12:57:50,INT-08750/16,Reklama w pasie drogowym ,PLAKATY (REKLAMY),OLSZEWSKIEGO /,MANDAT,200,2016-03-21 06:20:42
2016-03-10 12:59:08,INT-08749/16,osoba oddajaca mocz na elewacjję budynku,PORZĄDKOWA,ŚWIDNICKA /,MANDAT,200,2016-03-10 12:59:29
2016-03-10 13:01:53,INT-08751/16,pojazd zaparkowany za b-36,NIEPRAWIDŁOWE PARKOWANIE,NENCKIEGO /,MANDAT,100,2016-03-10 13:02:10
2016-03-10 13:05:17,INT-08752/16,stoisko handlowe na chodniku,HANDEL,OŁAWSKA /,MANDAT,100,2016-03-10 13:05:32
2016-03-10 13:10:18,INT-08753/16,Reklama w pasie drogowym,PLAKATY (REKLAMY),PARKOWA /,MANDAT,200,2016-03-21 06:22:40
2016-03-10 13:14:24,INT-08757/16,stoisko handlowe na terenie gminnym (wędzarnia),HANDEL,GROTA ROWECKIEGO /,MANDAT,50,2016-03-10 13:14:42
2016-03-10 13:25:06,INT-08764/16,zgłoszenie z ekosystemu dot. zanieczyszczonego terenu,PORZĄDKOWA,DĘBICKIEGO 10/,MANDAT,100,2016-04-26 06:05:57
2016-03-10 13:44:47,INT-08769/16,postój za znakiem b-36,BLOKADA,TERENOWA /,MANDAT,100,2016-03-10 13:46:26
2016-03-10 13:44:47,INT-08769/16,postój za znakiem b-36,BLOKADA,TERENOWA /,MANDAT,0,2016-03-10 13:46:26
2016-03-10 13:44:52,INT-08771/16,niestosowanie się do znaku B-1,BEZPIECZEŃSTWO W KOMUNIKACJI,MOSTY MŁYŃSKIE /,MANDAT,100,2016-03-10 13:44:52
2016-03-10 13:44:52,INT-08771/16,niestosowanie się do znaku B-1,BEZPIECZEŃSTWO W KOMUNIKACJI,MOSTY MŁYŃSKIE /,MANDAT,50,2016-03-10 13:44:52
2016-03-10 13:44:52,INT-08771/16,niestosowanie się do znaku B-1,BEZPIECZEŃSTWO W KOMUNIKACJI,MOSTY MŁYŃSKIE /,MANDAT,0,2016-03-10 13:44:52
2016-03-10 13:59:46,INT-08777/16,Kontrola parkowania za znakiem b-36 +t24,NIEPRAWIDŁOWE PARKOWANIE,SZEWSKA /,MANDAT,100,2016-03-10 13:59:52
2016-03-10 14:02:19,INT-08778/16,Kontrola parkowania za znakiem b-36 + t24,NIEPRAWIDŁOWE PARKOWANIE,WITA STWOSZA /,MANDAT,100,2016-03-10 14:02:40
2016-03-10 14:13:57,INT-08783/16,pojazdy za zakazem zatrzymywania+utrudnione wejście do klatek schodowych,NIEPRAWIDŁOWE PARKOWANIE,CYBULSKIEGO 33-41/,,0,2016-03-10 15:34:59
2016-03-10 14:54:44,INT-08793/16,a ul. Jeczmienna pojazd marki Seat Tolego  zaparkowany na skrzyżowaniu,NIEPRAWIDŁOWE PARKOWANIE,ŻYTNIA /,,0,2016-03-10 15:48:21
2016-03-10 15:57:22,INT-08796/16,od Kosmonautów do Porębskiej - D-40 w miejscach niewyznaczonych ,NIEPRAWIDŁOWE PARKOWANIE,JEŻOWSKA /,OSTRZEŻENIE,0,2016-03-10 17:02:21
2016-03-10 16:02:32,INT-08799/16,parkowanie nie przy krawędzi jezdni,BLOKADA,SZTABOWA /,,100,2016-03-10 16:02:52
2016-03-10 16:39:48,INT-08805/16,"Nieprawidłowe parkowanie na chodniku, brak 1,5 m przejśćia dla pieszych ",NIEPRAWIDŁOWE PARKOWANIE,PARKOWA 40/,,0,2016-03-10 21:32:45
2016-03-10 16:58:37,INT-08808/16,parkowanie za B-36,BLOKADA,KAZIMIERZA WIELKIEGO /,,100,2016-03-10 16:58:50
2016-03-10 16:58:37,INT-08808/16,parkowanie za B-36,BLOKADA,KAZIMIERZA WIELKIEGO /,,0,2016-03-10 16:58:50
2016-03-10 17:01:23,INT-08810/16,parkowanie za B-36,BLOKADA,OFIAR OŚWIĘCIMSKICH /,,100,2016-03-10 17:01:35
2016-03-10 17:02:25,INT-08811/16,kontrola parkowania za znakiem B36,NIEPRAWIDŁOWE PARKOWANIE,SZEWSKA 75/,MANDAT,100,2016-03-10 17:02:25
2016-03-10 17:03:18,INT-08813/16,parkowanie za B-36 i T-24,NIEPRAWIDŁOWE PARKOWANIE,WIERZBOWA /,LAWETA,100,2016-03-10 17:03:46
2016-03-10 17:11:27,INT-08816/16,Na wys. SP nr 83 pojazd marki Ford / kolor niebieski/ zaparkowany za B-36 dopuszczalne parkowanie do 10 min.,NIEPRAWIDŁOWE PARKOWANIE,BERENTA /,OSTRZEŻENIE,0,2016-03-10 18:12:30
2016-03-10 18:48:21,INT-08843/16,parkowanie za B-36 i T-24,NIEPRAWIDŁOWE PARKOWANIE,SOKOLNICZA /,LAWETA,100,2016-03-10 18:49:41
2016-03-10 18:53:47,INT-08846/16,kontrola parkowania w strefie zamieszkania ,NIEPRAWIDŁOWE PARKOWANIE,OŁAWSKA /,MANDAT,100,2016-03-10 18:53:47
2016-03-10 19:20:34,INT-08852/16,parkowanie na kopercie dla osoby niepełnosprawnej - umieszczone stare uprawnienia,NIEPRAWIDŁOWE PARKOWANIE,PLAC SOLNY /,POUCZENIE,0,2016-03-10 19:20:56
2016-03-10 19:22:31,INT-08853/16,kontrola parkowania za znakiem B36 + t24,NIEPRAWIDŁOWE PARKOWANIE,SZEWSKA 75/77/,POUCZENIE,0,2016-03-10 19:22:37
2016-03-10 19:24:02,INT-08854/16,kontrola parkowania za znakiem B36,NIEPRAWIDŁOWE PARKOWANIE,WIĘZIENNA /,POUCZENIE,0,2016-03-10 19:24:03
2016-03-10 19:27:22,INT-08855/16,parkowanie w strefie zamieszkania poza miejscami wyznaczonymi do parkowania,BLOKADA,MENNICZA /,,100,2016-03-10 19:27:38
2016-03-10 19:27:22,INT-08855/16,parkowanie w strefie zamieszkania poza miejscami wyznaczonymi do parkowania,BLOKADA,MENNICZA /,,0,2016-03-10 19:27:38
2016-03-10 19:29:13,INT-08857/16,parkowanie za B-36,BLOKADA,PIOTRA SKARGI /,,100,2016-03-10 19:29:44
2016-03-10 19:31:17,INT-08858/16,"postój na jezdni, utrudnienie ruchu kołowego",NIEPRAWIDŁOWE PARKOWANIE,CZARNIECKIEGO 66/,,0,2016-03-10 20:53:45
2016-03-10 19:31:38,INT-08859/16,parkowanie na postoju TAXI bez uprawnień,BLOKADA,KOMANDORSKA /,,0,2016-03-10 19:31:56
2016-03-10 20:00:10,INT-08863/16,Wpłynęło pismo dotyczące zaśmiecania miejsca gromadzenia odpadów podwórza Ofiar Oświęcimskich/Rynek/Świdnicka+,PORZĄDKOWA,OFIAR OŚWIĘCIMSKICH 19/,MANDAT,100,2016-04-18 05:57:33
2016-03-10 21:22:18,INT-08875/16,przy galeriowcu pojazd marki peugeot na trawniku -OD UL.LEGNICKIEJ POJAZD MARKI VOLVO BLOKUJE PODJAZD DLA NIEPEŁNOSPRAWNYCH,NISZCZENIE ZIELENI,BOLESŁAWIECKA 1/,,0,2016-03-10 23:23:51
2016-03-10 22:57:17,INT-08878/16,Handel na terenie gminy,HANDEL,STRZEGOMSKA /,MANDAT,100,2016-03-10 22:57:17
2016-03-10 23:03:06,INT-08880/16,Postój za znakiem D-40,NIEPRAWIDŁOWE PARKOWANIE,BULWAR DEDALA /,MANDAT,100,2016-03-10 23:03:06
2016-03-10 23:12:53,INT-08882/16,"Postój na chodniku brak 1,5m przejścia dla pieszych",NIEPRAWIDŁOWE PARKOWANIE,SUWALSKA /,MANDAT,100,2016-03-10 23:12:53
2016-03-10 23:29:50,INT-08883/16,Postój za znakiem B-36,NIEPRAWIDŁOWE PARKOWANIE,FIELDORFA /,MANDAT,100,2016-03-15 23:54:29
2016-03-10 23:35:36,INT-08884/16,Postój za znakiem B-36,NIEPRAWIDŁOWE PARKOWANIE,BIAŁOWIESKA /,MANDAT,100,2016-03-14 23:24:08
2016-03-10 23:54:30,INT-08886/16,KONTROLA RUCHU PIESZYCH ZA S-5,BEZPIECZEŃSTWO W KOMUNIKACJI,SIENKIEWICZA /,MANDAT,100,2016-03-10 23:55:07
2016-03-11 07:22:36,INT-08906/16,Parkowanie za znakiem B36,BLOKADA,ŚW.ANTONIEGO /,,0,2016-03-11 07:22:56
2016-03-11 08:47:42,INT-08917/16,"na wys. teatru Polskiego - pojazd Audi koloru granatowego, parkuje na chodniku, blokuje przejście pieszym",NIEPRAWIDŁOWE PARKOWANIE,BOGUSŁAWSKIEGO 11/,OSTRZEŻENIE,0,2016-03-11 09:28:47
2016-03-11 08:51:01,INT-08918/16,"parkowanie pojazdów w poprzek chodnika, blokowanie przejścia pieszym",NIEPRAWIDŁOWE PARKOWANIE,PARNICKIEGO 4/,WEZWANIE,0,2016-03-11 10:14:05
2016-03-11 09:02:21,INT-08921/16,Pojazd bez uprawnień zaparkowany na kopercie dla ZZK.,NIEPRAWIDŁOWE PARKOWANIE,ELŻBIETY 3/,OSTRZEŻENIE,0,2016-03-11 09:23:44
2016-03-11 09:40:58,INT-08927/16,Parkowanie na skrzyżowaniu Pretficza/Energetyczna,BLOKADA,PRETFICZA /,,300,2016-03-11 09:41:17
2016-03-11 09:40:58,INT-08927/16,Parkowanie na skrzyżowaniu Pretficza/Energetyczna,BLOKADA,PRETFICZA /,,0,2016-03-11 09:41:17
2016-03-11 10:09:43,INT-08934/16,Ekipa remontowa prowadząca przy boisku szkolnym prace budowlane wyrzuca gruz na tereny miejskie.,PORZĄDKOWA,JERZMANOWSKA 94/,MANDAT,200,2016-04-13 05:58:07
2016-03-11 10:16:33,INT-08935/16,Parkowanie na skrzyżowaniu Pretfica/Oficerska,BLOKADA,PRETFICZA /,,300,2016-03-11 10:16:48
2016-03-11 10:16:33,INT-08935/16,Parkowanie na skrzyżowaniu Pretfica/Oficerska,BLOKADA,PRETFICZA /,,0,2016-03-11 10:16:48
2016-03-11 10:20:34,INT-08937/16,Pojazdy zaparkowane na całej szerokości chodnika od ul.Na ostatnim groszu.,NIEPRAWIDŁOWE PARKOWANIE,SZYBOWCOWA /,,100,2016-03-11 17:22:42
2016-03-11 10:32:13,INT-08938/16,Parkowanie za znakiem B36,BLOKADA,ŚW.ANTONIEGO /,,100,2016-03-11 10:32:31
2016-03-11 10:32:13,INT-08938/16,Parkowanie za znakiem B36,BLOKADA,ŚW.ANTONIEGO /,,0,2016-03-11 10:32:31
2016-03-11 10:37:41,INT-08940/16,Parkowanie za znakiem B36,BLOKADA,ZAPOROSKA /,,100,2016-03-11 10:37:57
2016-03-11 10:37:41,INT-08940/16,Parkowanie za znakiem B36,BLOKADA,ZAPOROSKA /,,0,2016-03-11 10:37:57
2016-03-11 11:24:22,INT-08943/16,"na odcinku od Komandorskiej do Drukarskiej - pojazd koloru granatowego o pocz nr rej NO parkuje w poprzek chodnika, blokuje przejście pieszym",NIEPRAWIDŁOWE PARKOWANIE,WIELKA /,,100,2016-03-11 11:45:52
2016-03-11 11:26:21,INT-08944/16,zatrzymanie pojazdów na chodnikach w sposób utrudniający ruch pieszych i kołowy.,NIEPRAWIDŁOWE PARKOWANIE,SIELSKA /,,100,2016-03-17 00:27:13
2016-03-11 11:26:21,INT-08944/16,zatrzymanie pojazdów na chodnikach w sposób utrudniający ruch pieszych i kołowy.,NIEPRAWIDŁOWE PARKOWANIE,SIELSKA /,,0,2016-03-17 00:27:13
2016-03-11 11:31:57,INT-08945/16,parkowanie pojazdu w miejscu obowiązywania znaku B-36,BLOKADA,PRETFICZA /,POUCZENIE,0,2016-03-11 11:32:12
2016-03-11 11:36:59,INT-08947/16,Kontrola za znakiem b36 + t24,NIEPRAWIDŁOWE PARKOWANIE,SZEWSKA /,MANDAT,100,2016-03-11 11:38:21
2016-03-11 12:06:28,INT-08948/16,Pojazdy parkujące na B-36 i T-24.,NIEPRAWIDŁOWE PARKOWANIE,PLAC GRUNWALDZKI 3/,LAWETA,100,2016-03-11 23:39:02
2016-03-11 12:20:17,INT-08950/16,pismo w sprawie umieszczenia żagli reklamowych przed wejściem do lokalu Burger King ,PLAKATY (REKLAMY),RYNEK /,UPOMNIENIE,0,2016-03-11 13:17:43
2016-03-11 12:20:56,INT-08951/16,kontrola ruchu pieszych z B-41 przy Sky Tower,WYKROCZENIA PIESZYCH,POWSTAŃCÓW ŚLĄSKICH /,MANDAT,50,2016-03-11 12:29:59
2016-03-11 12:31:22,INT-08952/16,parkowanie nie przy krawędzi jezdni,NIEPRAWIDŁOWE PARKOWANIE,SZCZĘŚLIWA /,OSTRZEŻENIE,0,2016-03-11 12:37:08
2016-03-11 12:39:46,INT-08954/16,parkowanie nie przy krawędzi jezdni ,NIEPRAWIDŁOWE PARKOWANIE,SZCZĘŚLIWA /,MANDAT,100,2016-03-11 12:43:24
2016-03-11 12:47:03,INT-08955/16,kontrola ruchu pieszych,WYKROCZENIA PIESZYCH,DRUKARSKA 41/,MANDAT,100,2016-03-11 12:53:43
2016-03-11 13:07:24,INT-08968/16,handel na terenie gminy bez zezw,HANDEL,SKARBOWCÓW /,MANDAT,50,2016-03-11 13:08:31
2016-03-11 13:08:38,INT-08969/16,Zanieczyszczony wyjazd z budowy,PORZĄDKOWA,MAGELLANA /,MANDAT,200,2016-04-14 06:50:46
2016-03-11 13:11:22,INT-08972/16,pojazdy z budowy nanoszą błoto na jezdnię,PORZĄDKOWA,ŚWISTACKIEGO 24/,MANDAT,200,2016-05-16 08:27:05
2016-03-11 13:12:33,INT-08971/16,Wjazd za B-1,BEZPIECZEŃSTWO W KOMUNIKACJI,MOSTY MŁYŃSKIE /,MANDAT,100,2016-03-11 13:14:16
2016-03-11 13:14:49,INT-08973/16,B-36,NIEPRAWIDŁOWE PARKOWANIE,PLAC SOLNY /,MANDAT,100,2016-03-11 13:15:15
2016-03-11 14:04:12,INT-08976/16,Pojazdy zaparkowane na B-36 i T-24 przy Straży Pożarnej.,NIEPRAWIDŁOWE PARKOWANIE,TEATRALNA /,LAWETA,100,2016-03-11 15:29:33
2016-03-11 14:58:17,INT-08982/16,niestosowanie się do znaku B-1,BEZPIECZEŃSTWO W KOMUNIKACJI,MOSTY MŁYŃSKIE /,MANDAT,100,2016-03-11 14:58:17
2016-03-11 14:58:17,INT-08982/16,niestosowanie się do znaku B-1,BEZPIECZEŃSTWO W KOMUNIKACJI,MOSTY MŁYŃSKIE /,MANDAT,50,2016-03-11 14:58:17
2016-03-11 15:27:52,INT-08985/16,parkowanie za B-36,BLOKADA,KOMANDORSKA /,,100,2016-03-11 15:28:04
2016-03-11 15:32:04,INT-08987/16,pojazd o parkuje na pasach wyłączonych z ruchu,NIEPRAWIDŁOWE PARKOWANIE,GWARNA 19/21/,,0,2016-03-11 15:57:01
2016-03-11 15:44:20,INT-08989/16,parkowanie za B-36,BLOKADA,DĄBROWSKIEGO /,,100,2016-03-11 15:45:24
2016-03-11 15:44:20,INT-08989/16,parkowanie za B-36,BLOKADA,DĄBROWSKIEGO /,,0,2016-03-11 15:45:24
2016-03-11 16:12:55,INT-08991/16,Pojazdy nieuprawnione parkujące na postoju TAXI.,NIEPRAWIDŁOWE PARKOWANIE,KOMANDORSKA /,,100,2016-03-11 17:21:52
2016-03-11 16:12:55,INT-08991/16,Pojazdy nieuprawnione parkujące na postoju TAXI.,NIEPRAWIDŁOWE PARKOWANIE,KOMANDORSKA /,,0,2016-03-11 17:21:52
2016-03-11 16:39:05,INT-08994/16,Parkowanie na postoju TAXI bez uprawnień,BLOKADA,SANOCKA /,,100,2016-03-11 16:40:28
2016-03-11 18:43:06,INT-09008/16,Ul. Drukarska a Sztabowa parkowanie w odległości mniejszej niż 10 m od skrzyżowania,BLOKADA,DRUKARSKA /,,100,2016-03-11 18:43:12
2016-03-11 18:43:06,INT-09008/16,Ul. Drukarska a Sztabowa parkowanie w odległości mniejszej niż 10 m od skrzyżowania,BLOKADA,DRUKARSKA /,,0,2016-03-11 18:43:12
2016-03-11 19:00:37,INT-09010/16,parkowanie pojazdów za B-36,NIEPRAWIDŁOWE PARKOWANIE,WŁODKOWICA /,,100,2016-03-12 03:08:58
2016-03-11 19:12:25,INT-09012/16,parkowanie za B-36,BLOKADA,BOGUSŁAWSKIEGO /,,100,2016-03-11 19:12:38
2016-03-11 19:25:58,INT-09013/16,Dwa busy zaparkowane w poprzek  osi jezdni utrudniaja ruch na jezdni.,NIEPRAWIDŁOWE PARKOWANIE,MIERNICZA 26/,,0,2016-03-12 00:02:11
2016-03-11 20:32:14,INT-09024/16,niezastosowanie sie do sygnalizatora s5,WYKROCZENIA PIESZYCH,PLAC DOMINIKAŃSKI /,POUCZENIE,0,2016-03-11 20:34:17
2016-03-11 20:35:03,INT-09026/16,Mężczyzna gra na gitarze przy użyciu wzmacniacza,PORZĄDKOWA,PRZEJŚCIE WINOGRONOWE /,POUCZENIE,0,2016-03-11 20:36:28
2016-03-11 20:49:00,INT-09030/16,parkowanie na postoju taxi,NIEPRAWIDŁOWE PARKOWANIE,KOMANDORSKA /,,100,2016-03-11 21:58:52
2016-03-11 20:49:00,INT-09030/16,parkowanie na postoju taxi,NIEPRAWIDŁOWE PARKOWANIE,KOMANDORSKA /,,0,2016-03-11 21:58:52
2016-03-11 21:21:55,INT-09031/16,"POJAZD ZAPARKOWANY CHODNIK+TRAWNIK, UTRUDNIONE PRZEJŚCIE DLA PIESZYCH",NIEPRAWIDŁOWE PARKOWANIE,ŻMUDZKA 11/,,0,2016-03-12 01:25:02
2016-03-11 21:30:34,INT-09033/16,PISMO W SPRAWIE NIEPRAWIDŁOWGO PARKOWANIA UL. SKŁODOWSKIEJ 5,NIEPRAWIDŁOWE PARKOWANIE,SKŁODOWSKIEJ /,,0,2016-03-18 13:24:40
2016-03-11 22:55:58,INT-09041/16,A DROHOBYCKA PARKOWANIE NA SKRZYŻOWANIU,NIEPRAWIDŁOWE PARKOWANIE,SŁONIMSKA /,,0,2016-03-16 01:03:37
2016-03-11 23:22:13,INT-09043/16,przy Arkadach parkowanie na postoju taxi,NIEPRAWIDŁOWE PARKOWANIE,NASYPOWA /,,100,2016-03-11 23:45:55
2016-03-12 08:41:42,INT-09056/16,A KASPRZAKA PEUGEOT DW 688... BLOKUJE DOSTĘP DO OSŁONY ŚMIETNIKOWEJ,NIEPRAWIDŁOWE PARKOWANIE,I DYWIZJI /,,0,2016-03-22 02:01:21
2016-03-12 09:16:16,INT-09064/16,"Przy budynku ul. Bolesławiecka 1, od strony ul. Legnickiej dwa pojazdy. Volvo brak 1,5m (pozost.ok 80cm) i Peugeot EPI.... stwarzający zagrożenie przy wyjeździe na Legnicką - niszczenie roślinności.",NIEPRAWIDŁOWE PARKOWANIE,LEGNICKA /,,50,2016-03-12 15:24:06
2016-03-12 09:49:23,INT-09066/16,Pojazdy na pasach wyłączonych z ruchu.,NIEPRAWIDŁOWE PARKOWANIE,WIELKA 26-28/,,100,2016-03-12 14:31:08
2016-03-12 09:49:23,INT-09066/16,Pojazdy na pasach wyłączonych z ruchu.,NIEPRAWIDŁOWE PARKOWANIE,WIELKA 26-28/,,0,2016-03-12 14:31:08
2016-03-12 09:51:08,INT-09065/16,POMIĘDZY RADOSNĄ A WIELKĄ PARKOWANIE NA CHODNIKU ZA B-36,NIEPRAWIDŁOWE PARKOWANIE,KOMANDORSKA /,,100,2016-03-12 14:28:55
2016-03-12 11:40:02,INT-09076/16,PARKOWANIE NA CHODNIKU - BLOKOWANIE,NIEPRAWIDŁOWE PARKOWANIE,PIĘKNA 62AA-62AC/,,0,2016-03-12 17:09:07
2016-03-12 15:53:56,INT-09106/16,PARKOWANIE W MIEJSCU TAXI BEZ UPRAWNIEŃ,NIEPRAWIDŁOWE PARKOWANIE,KOMANDORSKA /,,100,2016-03-12 18:51:55
2016-03-12 15:53:56,INT-09106/16,PARKOWANIE W MIEJSCU TAXI BEZ UPRAWNIEŃ,NIEPRAWIDŁOWE PARKOWANIE,KOMANDORSKA /,,0,2016-03-12 18:51:55
2016-03-12 22:54:45,INT-09123/16,pojazd BMW - parkuje przed szlabnem - na wys. osiedla Ogrody Hallera,NIEPRAWIDŁOWE PARKOWANIE,HALLERA 80/84/,OSTRZEŻENIE,0,2016-03-13 00:22:50
2016-03-13 08:38:15,INT-09130/16,PARKOWANIE POJAZDÓW NA PASIE WYŁĄCZONYM Z RUCHU P-21.,NIEPRAWIDŁOWE PARKOWANIE,WIELKA 26-29/,,0,2016-03-13 14:36:24
2016-03-13 09:12:52,INT-09131/16,JADĄC OD UL. BOROWSKIEJ W OKOLICY SKLEPU SPOŻYWCZEGO PARKOWANIE W STREFIE RUCHU ZA ZNAKIEM B-36 ORAZ W OKOLICY PRZEJŚCIA DLA PIESZYCH ZA B-35 DO 15 MINUT.,NIEPRAWIDŁOWE PARKOWANIE,DŁUGOPOLSKA /,,0,2016-03-13 16:12:06
2016-03-13 10:00:26,INT-09135/16,"PARKOWANIE POJAZDÓW NA CHODNIKU BRAK 1,5 PRZEJŚCIA ORAZ W OKOLICY PAWILONU ""TĘCZA"".",NIEPRAWIDŁOWE PARKOWANIE,PAWŁOWA 6-8/,,100,2016-03-13 11:28:07
2016-03-13 10:24:48,INT-09136/16,PRZY REMONTOWANYM DWORCU PKP PARKOWANIE POJAZDÓW ZA ZNAKIEM B-26+T-24.,NIEPRAWIDŁOWE PARKOWANIE,JOANITÓW /,,100,2016-03-13 13:13:25
2016-03-13 11:22:11,INT-09139/16,Na trawniku zaparkowane 2 pojazdy: VW Transporter i Seat niszczą roślinność.,NISZCZENIE ZIELENI,BAJANA 73/,,300,2016-03-13 12:17:50
2016-03-13 12:02:44,INT-09144/16,Volvo zaparkowane w sposób utrudniający ruch (przy Kasprowicza).,NIEPRAWIDŁOWE PARKOWANIE,WINCENTEGO POLA /,MANDAT,100,2016-03-15 02:33:49
2016-03-13 12:53:01,INT-09146/16,Przy DZDZ parkowanie za B-36.,NIEPRAWIDŁOWE PARKOWANIE,WIŚNIOWA /,,100,2016-03-13 13:27:59
2016-03-13 15:00:59,INT-09155/16,Parkowanie na postoju taxi.,NIEPRAWIDŁOWE PARKOWANIE,KOMANDORSKA /,,100,2016-03-13 17:43:33
2016-03-13 16:55:01,INT-09163/16,"Nieprawidłowe parkowanie, blokowanie wyjazdu.",NIEPRAWIDŁOWE PARKOWANIE,JODŁOWA /,,100,2016-03-13 17:23:52
2016-03-13 17:35:51,INT-09165/16,WJAZD OD UL. MGLISTEJ PO PRAWEJ STRONIE PARKOWANIE W STREFIE RUCHU ZA ZNAKIEM ZAKAZU.,NIEPRAWIDŁOWE PARKOWANIE,BABIEGO LATA /,,0,2016-03-13 23:56:43
2016-03-13 19:38:30,INT-09167/16,Od Krupniczej parkowanie za B-36.,NIEPRAWIDŁOWE PARKOWANIE,WŁODKOWICA /,,100,2016-03-14 00:26:59
2016-03-13 19:38:30,INT-09167/16,Od Krupniczej parkowanie za B-36.,NIEPRAWIDŁOWE PARKOWANIE,WŁODKOWICA /,,0,2016-03-14 00:26:59
2016-03-13 21:45:12,INT-09170/16,a ul.Stanisławskiego   utrudnienie przejazdu przez zaparkowany pojazd Audi,NIEPRAWIDŁOWE PARKOWANIE,OLSZEWSKIEGO /,,0,2016-03-14 11:35:46
2016-03-14 00:16:38,INT-09173/16,Toyota DW0567J zaparkowana na zjeździe do garażu za B-36.,NIEPRAWIDŁOWE PARKOWANIE,WIWULSKIEGO 20-22/,,0,2016-03-14 08:50:18
2016-03-14 08:46:04,INT-09200/16,A GRUNWALDZKA POJAZD NA PRZEJŚCIU DLA PIESZYCH (KOLORU SREBRNEGO),NIEPRAWIDŁOWE PARKOWANIE,SUCHARDY /,,100,2016-03-14 11:06:03
2016-03-14 08:46:04,INT-09200/16,A GRUNWALDZKA POJAZD NA PRZEJŚCIU DLA PIESZYCH (KOLORU SREBRNEGO),NIEPRAWIDŁOWE PARKOWANIE,SUCHARDY /,,0,2016-03-14 11:06:03
2016-03-14 08:46:04,INT-09200/16,A GRUNWALDZKA POJAZD NA PRZEJŚCIU DLA PIESZYCH (KOLORU SREBRNEGO),NIEPRAWIDŁOWE PARKOWANIE,SUCHARDY /,,300,2016-03-14 11:06:03
2016-03-14 09:03:00,INT-09204/16,a Energetyczna parkowanie na skrzyżowaniu,BLOKADA,PRETFICZA /,,300,2016-03-14 09:03:19
2016-03-14 09:03:00,INT-09204/16,a Energetyczna parkowanie na skrzyżowaniu,BLOKADA,PRETFICZA /,,0,2016-03-14 09:03:19
2016-03-14 09:12:05,INT-09209/16,"od ronda do SKy Tower a Zielińskiego parkowanie na trawnikach, niszczenie zieleni - sytuacja powtarza się codziennie od poniedziałku do piątku. Prośba o działania prewencyjne. ",NISZCZENIE ZIELENI,SZCZĘŚLIWA /,,0,2016-03-14 10:55:42
2016-03-14 09:22:35,INT-09212/16,na wys. budowy Budotexu - nieprawidłowe parkowanie pojazdów poza miejscami wyznaczonymi,NIEPRAWIDŁOWE PARKOWANIE,JEŹDZIECKA 18/,,0,2016-03-14 10:07:52
2016-03-14 10:16:24,INT-09227/16,parkowanie za B-36,NIEPRAWIDŁOWE PARKOWANIE,SWOBODNA /,,0,2016-03-14 10:17:00
2016-03-14 10:22:02,INT-09228/16,A LĄDECKA CAŁKOWICIE ZABLOKOWANY CHODNIK,NIEPRAWIDŁOWE PARKOWANIE,DŁUGOPOLSKA /,,0,2016-03-14 11:41:26
2016-03-14 10:23:13,INT-09229/16,A WALECZNYCH UTRUDNIONY DOJAZD DO OGRODÓW DZIAŁKOWYCH + REJA 72B UTRUDNIONY DOJAZD DO GARAZY,NIEPRAWIDŁOWE PARKOWANIE,REJA /,,0,2016-03-14 11:34:26
2016-03-14 10:59:18,INT-09238/16,przejście w miejscu niedozwolonym,WYKROCZENIA PIESZYCH,SWOBODNA /,MANDAT,50,2016-03-14 11:00:01
2016-03-14 11:01:43,INT-09240/16,parkowanie za B-35,BLOKADA,POMORSKA /,,100,2016-03-14 11:03:05
2016-03-14 11:04:56,INT-09243/16,parkowanie w strefie zamieszkania poza miejscem wyznaczonym do parkowania,BLOKADA,KSIĘCIA WITOLDA /,,0,2016-03-14 11:06:12
2016-03-14 11:07:41,INT-09244/16,"pojazd marki VW zaparkowany w strefie zamieszkania, poza miejscem wyznaczonym ",NIEPRAWIDŁOWE PARKOWANIE,CHRZANOWSKIEGO 10/,,0,2016-03-14 13:16:30
2016-03-14 11:16:54,INT-09245/16,parkowanie za B-36,BLOKADA,GRABISZYŃSKA /,,100,2016-03-14 11:17:08
2016-03-14 11:16:54,INT-09245/16,parkowanie za B-36,BLOKADA,GRABISZYŃSKA /,,0,2016-03-14 11:17:08
2016-03-14 12:06:34,INT-09262/16,interwencja wobec osoby handlującej  kwiatami na terenie gminy,HANDEL,SKARBOWCÓW 6-8/,MANDAT,50,2016-03-14 12:06:34
2016-03-14 12:16:51,INT-09265/16,kontrola handlu na terenie parku kulturowego,HANDEL,OŁAWSKA /,MANDAT,100,2016-03-14 12:16:51
2016-03-14 12:34:09,INT-09269/16,zablokowany wyjazd z posesji,NIEPRAWIDŁOWE PARKOWANIE,ŻEGLARSKA 57/,,100,2016-03-14 13:10:43
2016-03-14 12:53:03,INT-09274/16,parkowanie za B-36+T-24,NIELEGALNY POŁÓW RYB,DWORCOWA 7/,,100,2016-03-14 17:06:08
2016-03-14 13:16:08,INT-09280/16,Parkowanie za B-36 i P-21,BLOKADA,PLAC MUZEALNY /,,100,2016-03-14 13:16:23
2016-03-14 13:18:19,INT-09282/16,Parkowanie na pasach wyłaczonych z ruchu P-21,BLOKADA,ŚWIEBODZKA /,,0,2016-03-14 13:18:29
2016-03-14 13:20:23,INT-09283/16,Parkowanie za B-36,BLOKADA,BERNARDYŃSKA /,,100,2016-03-14 13:20:29
2016-03-14 13:21:59,INT-09284/16,Parkowanie na pasach wyłączonych z ruchu P-21,BLOKADA,BOGUSŁAWSKIEGO /,,100,2016-03-14 13:22:09
2016-03-14 13:28:48,INT-09286/16,kontrla parkowania za znakeim B36 oraz na skrzyżowaniu,NIEPRAWIDŁOWE PARKOWANIE,LEGNICKA /,MANDAT,100,2016-03-14 13:29:58
2016-03-14 13:28:48,INT-09286/16,kontrla parkowania za znakeim B36 oraz na skrzyżowaniu,NIEPRAWIDŁOWE PARKOWANIE,LEGNICKA /,MANDAT,0,2016-03-14 13:29:58
2016-03-14 14:16:21,INT-09298/16,POMIĘDZY KUŹNICZĄ A SZEWSKĄ BIAŁY SEAT DMI .... PARKUJE ZA B-36 PRZY STOJAKACH DLA ROWERÓW,NIEPRAWIDŁOWE PARKOWANIE,NOŻOWNICZA /,,100,2016-03-14 16:21:46
2016-03-14 14:25:03,INT-09299/16,"A ZIELIŃSKIEGO NA JEZDNI ZAPARKOWANY POJAZD MAZDA (NIEBIESKA) W ODLEGŁOŚCI MNIEJSZEJ NIŻ 10M OD PZEJŚCIA DLA PIESZYCH, UTRUDNIA.",NIEPRAWIDŁOWE PARKOWANIE,SZCZĘŚLIWA /,,0,2016-03-14 14:52:59
2016-03-14 15:29:14,INT-09309/16,POMIĘDZY GROCHOWĄ A STALOWĄ PARKOWANIE NA CHODNIKU ZA PASEM ZIELENI,NIEPRAWIDŁOWE PARKOWANIE,PERECA /,,0,2016-03-14 17:42:56
2016-03-14 16:08:00,INT-09319/16,droga wewnętrzna - parkowanie za B-36,NIEPRAWIDŁOWE PARKOWANIE,DOLNOBRZESKA 40A/,,0,2016-03-17 00:15:47
