2016-05-03 17:17:26,INT-16712/16,kontrola promenady staromiejskiej z uwagą na art.43'uwtpa,SPOŻYWANIE ALKOHOLU,WŁODKOWICA /,MANDAT,50,2016-05-03 17:21:05
2016-05-03 17:24:21,INT-16713/16,parkowanie na zakazie,NIEPRAWIDŁOWE PARKOWANIE,MALARSKA /,,100,2016-05-03 20:40:16
2016-05-03 17:24:21,INT-16713/16,parkowanie na zakazie,NIEPRAWIDŁOWE PARKOWANIE,MALARSKA /,,0,2016-05-03 20:40:16
2016-05-03 21:19:43,INT-16726/16,róg Witelona - zablokowany wjazd na posesję,NIEPRAWIDŁOWE PARKOWANIE,PARKOWA 19A/,LAWETA,100,2016-05-05 00:59:24
2016-05-03 21:19:43,INT-16726/16,róg Witelona - zablokowany wjazd na posesję,NIEPRAWIDŁOWE PARKOWANIE,PARKOWA 19A/,LAWETA,0,2016-05-05 00:59:24
2016-05-04 07:18:37,INT-16736/16,parkowanie pojazdów za D-40 w miejscach niewyznaczonych i na P-21-GODZ. 09.30 KOLEJNE ZGŁOSZENIE ,NIEPRAWIDŁOWE PARKOWANIE,ZAPOROSKA 34-36/,,100,2016-05-04 10:34:56
2016-05-04 07:18:37,INT-16736/16,parkowanie pojazdów za D-40 w miejscach niewyznaczonych i na P-21-GODZ. 09.30 KOLEJNE ZGŁOSZENIE  ,NIEPRAWIDŁOWE PARKOWANIE,ZAPOROSKA 34-36/,,0,2016-05-04 10:34:56
2016-05-04 09:08:12,INT-16749/16,A UL. NABYCIŃSKA. NAGMINNE PARKOWNIE POJAZDU MARKI PEUGEOT 406  O NR REJ  NA TRAWNIKU.o godz. 10:10 na ul. Nabycińskiej a Braniborskiej wystawiłem wezwanie komunikacyjne  na pojazd marki PEUGEOT 307  w związku z parkowaniem na pasie zieleni - niszczenie roślinności.,NISZCZENIE ZIELENI,BRANIBORSKA /,,0,2016-05-04 10:08:41
2016-05-04 09:26:24,INT-16752/16,PARKOWANIE POJAZDU ZA B-36 PRZY SZPITALU,NIEPRAWIDŁOWE PARKOWANIE,GRABISZYŃSKA 105/,,100,2016-05-04 17:16:06
2016-05-04 09:30:26,INT-16754/16,PARKOWANIE POJAZDU MARKI PEUGEOT  PRZY WJEŹDZIE NA MOSTY MIESZCZAŃSKIE ORAZ PARKOWANIE POJAZDÓW NA TRAWNIKU.,NIEPRAWIDŁOWE PARKOWANIE,MIESZCZAŃSKA /,,100,2016-05-04 19:25:31
2016-05-04 09:30:26,INT-16754/16,PARKOWANIE POJAZDU MARKI PEUGEOT  PRZY WJEŹDZIE NA MOSTY MIESZCZAŃSKIE ORAZ PARKOWANIE POJAZDÓW NA TRAWNIKU.,NIEPRAWIDŁOWE PARKOWANIE,MIESZCZAŃSKA /,,0,2016-05-04 19:25:31
2016-05-04 09:34:25,INT-16756/16,A RUSKA VIS A VI GINESA PRZY WIEŻCZCE PARKOWANIE POJZDÓW ,NIEPRAWIDŁOWE PARKOWANIE,PLAC SOLNY /,,0,2016-05-04 11:31:33
2016-05-04 10:11:23,INT-16760/16,Nieprzestrzeganie sygnalizatora S-5 przejscie na czerwonym świetle,WYKROCZENIA PIESZYCH,PLAC LEGIONÓW /,,100,2016-05-04 10:11:49
2016-05-04 10:25:29,INT-16763/16,SKRZYZOWANIE Z UL. MUCHOBORSKĄ. PARKOWANIE POJAZDU MARKI RENAULT  NA PRZEJŚCIU DLA PIESZYCH.,NIEPRAWIDŁOWE PARKOWANIE,TRAKTATOWA /,,300,2016-05-06 15:59:15
2016-05-04 10:25:29,INT-16763/16,SKRZYZOWANIE Z UL. MUCHOBORSKĄ. PARKOWANIE POJAZDU MARKI RENAULT NA PRZEJŚCIU DLA PIESZYCH.,NIEPRAWIDŁOWE PARKOWANIE,TRAKTATOWA /,,0,2016-05-06 15:59:15
2016-05-04 10:28:26,INT-16765/16,Parkowanie na powierzchni wyłaczonej z ruchu P-21,BLOKADA,GWARNA /,,0,2016-05-04 10:28:34
2016-05-04 11:23:44,INT-16775/16,NA CHODNIKU PARKUJE POJAZD OSOBOWY W SPOSÓB UTRUDNIAJĄCY RUCH PIESZY.,NIEPRAWIDŁOWE PARKOWANIE,PRZESTRZENNA 14/,,0,2016-05-04 11:56:12
2016-05-04 12:12:05,INT-16787/16,SKRZYŻOWANIE Z UL. WIECZYSTĄ. PARKOWANIE POJAZDÓW NA CHODNIKU BRAK PRZEJŚCIA DLA PIESZYCH.,NIEPRAWIDŁOWE PARKOWANIE,KAMIENNNA /,,100,2016-05-04 13:22:31
2016-05-04 12:12:05,INT-16787/16,SKRZYŻOWANIE Z UL. WIECZYSTĄ. PARKOWANIE POJAZDÓW NA CHODNIKU BRAK PRZEJŚCIA DLA PIESZYCH.,NIEPRAWIDŁOWE PARKOWANIE,KAMIENNNA /,,0,2016-05-04 13:22:31
2016-05-04 12:19:48,INT-16788/16,Parkowanie za B-36,BLOKADA,MENNICZA /,,100,2016-05-04 12:20:11
2016-05-04 12:19:48,INT-16788/16,Parkowanie za B-36,BLOKADA,MENNICZA /,,0,2016-05-04 12:20:11
2016-05-04 12:31:13,INT-16791/16,PRZY POMNIKU KOŃ NAGMINNIE ZAPARKOWANY POJAZD KOLOR FIOLETOWO NIEBIESKI ORAZ 20 M DALEJ PRZY SPOŻYWCZYM SPRAWDZIĆ PARKOWANIE.,NIEPRAWIDŁOWE PARKOWANIE,SZEWSKA 18/,,100,2016-05-04 14:02:52
2016-05-04 12:31:13,INT-16791/16,PRZY POMNIKU KOŃ NAGMINNIE ZAPARKOWANY POJAZD KOLOR FIOLETOWO NIEBIESKI ORAZ 20 M DALEJ PRZY SPOŻYWCZYM SPRAWDZIĆ PARKOWANIE.,NIEPRAWIDŁOWE PARKOWANIE,SZEWSKA 18/,,0,2016-05-04 14:02:52
2016-05-04 12:31:46,INT-16793/16,Parkowanie za B-36,BLOKADA,GRABISZYŃSKA /,,100,2016-05-04 12:31:52
2016-05-04 12:31:46,INT-16793/16,Parkowanie za B-36,BLOKADA,GRABISZYŃSKA /,,0,2016-05-04 12:31:52
2016-05-04 12:40:35,INT-16795/16,Parkowanie za B-36,BLOKADA,SZPITALNA /,,100,2016-05-04 12:40:54
2016-05-04 12:42:40,INT-16796/16,NA WYSKOŚCI SKLEPU DINO A VIS A WI PASAŻU ZIELIŃSKIEGO PARKOWANIE POJAZDÓW NA CHODNIKU W SPOSÓB ZMUSZAJĄCYCH PIESZYCH DO KOŻYSTANIA Z ŚCIEZKU DLA ROWERÓW,NIEPRAWIDŁOWE PARKOWANIE,SWOBODNA /,,100,2016-05-04 17:18:06
2016-05-04 13:30:27,INT-16803/16,PRZY BIEDRONCE PARKOWANIE POJAZDÓW PRZY PRZEJŚCIU I NIE PRZY KRAWEDZI JEZDNI,NIEPRAWIDŁOWE PARKOWANIE,JEDNOŚCI NARODOWEJ /,,100,2016-05-06 01:59:24
2016-05-04 13:56:41,INT-16806/16,PROŚBA OD PREZESA PARKU MASZYNOWEGO O INTERWENCJE -  JUTRO DELEGACJA RZADOWA O PARKOWANIE OK. 40 POJAZDÓW ZA ZNAKIEM B-36+T-24. GODZ. 14.05 ROZMOWA  Z KIER. ZM. K. URBAŃSKA O WSPARCIE .,NIEPRAWIDŁOWE PARKOWANIE,DUŃSKA 9/,,300,2016-05-04 18:38:44
2016-05-04 13:56:41,INT-16806/16,"PROŚBA OD PREZESA PARKU MASZYNOWEGO O INTERWENCJE -  JUTRO DELEGACJA RZADOWA O PARKOWANIE OK. 40 POJAZDÓW ZA ZNAKIEM B-36+T-24. GODZ. 14.05 ROZMOWA  Z KIER. O WSPARCIE PRZEZ PATROL BLOK. 30-312 ( SIELICKI, MIESZAŁA).  30-112  ZMOT.",NIEPRAWIDŁOWE PARKOWANIE,DUŃSKA 9/,,100,2016-05-04 18:38:44
2016-05-04 13:56:47,INT-16807/16,PRZY KSIĘGARNI HANDEL KWIATAMI,HANDEL,PLAC LEGIONÓW /,,50,2016-05-04 14:47:31
2016-05-04 14:27:12,INT-16810/16,kontrola parkowania za znakiem B-36,NIEPRAWIDŁOWE PARKOWANIE,BOGUSŁAWSKIEGO /,,100,2016-05-04 14:27:24
2016-05-04 14:29:25,INT-16811/16,A PL.LEGIONÓW KONTROLA PARKOWANIA NA SKRZYŻOWANIU ORAZ ZA ZNAKIEM B-35,NIEPRAWIDŁOWE PARKOWANIE,SĄDOWA /,,500,2016-05-04 14:29:35
2016-05-04 14:29:25,INT-16811/16,A PL.LEGIONÓW KONTROLA PARKOWANIA NA SKRZYŻOWANIU ORAZ ZA ZNAKIEM B-35,NIEPRAWIDŁOWE PARKOWANIE,SĄDOWA /,,300,2016-05-04 14:29:35
2016-05-04 14:29:25,INT-16811/16,A PL.LEGIONÓW KONTROLA PARKOWANIA NA SKRZYŻOWANIU ORAZ ZA ZNAKIEM B-35,NIEPRAWIDŁOWE PARKOWANIE,SĄDOWA /,,100,2016-05-04 14:29:35
2016-05-04 14:29:25,INT-16811/16,A PL.LEGIONÓW KONTROLA PARKOWANIA NA SKRZYŻOWANIU ORAZ ZA ZNAKIEM B-35,NIEPRAWIDŁOWE PARKOWANIE,SĄDOWA /,,0,2016-05-04 14:29:35
2016-05-04 14:31:55,INT-16812/16,KONTROLA PARKOWANIA ZA ZNAKIEM B-36,NIEPRAWIDŁOWE PARKOWANIE,TĘCZOWA /,,100,2016-05-04 14:32:05
2016-05-04 14:33:27,INT-16813/16,KONTROLA PARKOWNIA ZA ZNAKIEM B-36,NIEPRAWIDŁOWE PARKOWANIE,GWIAŹDZISTA /,,100,2016-05-04 14:33:34
2016-05-04 14:35:05,INT-16814/16,kontrola parkowania za znakiem B-36,NIEPRAWIDŁOWE PARKOWANIE,KOMANDORSKA /,,100,2016-05-04 14:35:14
2016-05-04 14:35:05,INT-16814/16,kontrola parkowania za znakiem B-36,NIEPRAWIDŁOWE PARKOWANIE,KOMANDORSKA /,,0,2016-05-04 14:35:14
2016-05-04 14:37:54,INT-16815/16,"SKRZYZOWANIE Z UL. SKWEROWĄ. PARKOWANIE POJAZDU MARKI FIAT PANDA ONA PASIE RUCHU W ODLEGŁOŚCI MNIEJSZEJ NIŻ 10 M OD SKRZYZOWANIA , BLOKOWANIE PASA RUCHU.GODZ. 15.00 ZGŁOSZENIE  ZGŁASZAŁ O 12.00 PATROLOWI ZMOT. NIE WIE KTÓREMU.",NIEPRAWIDŁOWE PARKOWANIE,KOMANDORSKA /,,100,2016-05-04 15:39:21
2016-05-04 14:47:09,INT-16816/16,ZGŁASZAJĄCA PORUSZAJĄCA SIĘ POJAZDEM MARKI RENAULT ZAPARKOWANA NA PARKONGU POJAZD ZA NIA NA P-21 UNIEMOZLIWIŁ JEJ WYJAZD,NIEPRAWIDŁOWE PARKOWANIE,PLAC KONSTYTUCJI 3-GO MAJA /,MANDAT,100,2016-05-04 16:11:41
2016-05-04 15:05:06,INT-16817/16,kontrola parkowania za znakiem  B-36,NIEPRAWIDŁOWE PARKOWANIE,BERNARDYŃSKA /,,100,2016-05-04 15:05:17
2016-05-04 15:05:06,INT-16817/16,kontrola parkowania za znakiem  B-36,NIEPRAWIDŁOWE PARKOWANIE,BERNARDYŃSKA /,,0,2016-05-04 15:05:17
2016-05-04 16:04:54,INT-16822/16,UL. TRAMWAJOWA A DEMBOWSKIEGO PRZY WJEŻDZIE NA TEREN PRZEDSZKOLA NA TRAWNIKU ZAPARKOWANY POJAZD M-KI ALFA147 POCZĄTKOWE NR. REJ. FZI (KOLOR SREBRNY ) - NISZCZY ZIELEŃ (WG ZGŁASZAJĄCEGO NOWY TRAWNIK),NISZCZENIE ZIELENI,TRAMWAJOWA /,,0,2016-05-04 19:10:29
2016-05-04 17:03:26,INT-16827/16,"PARKOWANIE POJAZDÓW NA CHODNIKU ZA B-36 BRAK 1,5M PRZEJŚCIA",NIEPRAWIDŁOWE PARKOWANIE,WYSPIAŃSKIEGO 18/,,0,2016-05-04 18:08:34
2016-05-04 17:57:57,INT-16830/16,kontrola parkowania za znakiem B-36,NIEPRAWIDŁOWE PARKOWANIE,KAZIMIERZA WIELKIEGO 7/,,100,2016-05-04 17:58:30
2016-05-04 18:17:19,INT-16835/16,Kontrola nielegalnego handlu na terenie Parku Kulturowego,HANDEL,OŁAWSKA /,MANDAT,50,2016-05-04 18:19:44
2016-05-04 18:18:04,INT-16832/16,Kontrola parkowania ul. Malarska B-36,NIEPRAWIDŁOWE PARKOWANIE,MALARSKA /,MANDAT,100,2016-05-04 18:21:09
2016-05-04 19:01:05,INT-16838/16,PARKOWANIE  6 POJAZDÓW W STREFIE ZAMIESZKANIA POZA MIEJSCAMI WYZNACZONYMI. WEDŁUG ZGŁASZAJACEGO ZOSTAŁO POPRAWIONE OZNAKOWANIE. ,NIEPRAWIDŁOWE PARKOWANIE,"STRZEGOMSKA 3 B, 3 C/",,100,2016-05-05 00:28:00
2016-05-04 19:24:06,INT-16842/16,Kontrola ruchu pojazdów - znak B1,BEZPIECZEŃSTWO W KOMUNIKACJI,SZEWSKA /,MANDAT,50,2016-05-04 19:24:20
2016-05-04 19:31:59,INT-16843/16,PARKOWANIE POJAZDÓW PO OBU STRONACH ULICY ZA ZNAKIEM B-36.,NIEPRAWIDŁOWE PARKOWANIE,WŁODKOWICA /,,100,2016-05-05 00:27:29
2016-05-04 19:31:59,INT-16843/16,PARKOWANIE POJAZDÓW PO OBU STRONACH ULICY ZA ZNAKIEM B-36.,NIEPRAWIDŁOWE PARKOWANIE,WŁODKOWICA /,,0,2016-05-05 00:27:29
2016-05-04 20:19:42,INT-16849/16,postój pojazdu ciężarowego na poboczu i chodniku za znakiem B-36 ,NIEPRAWIDŁOWE PARKOWANIE,NENCKIEGO /,MANDAT,100,2016-05-04 20:21:29
2016-05-04 20:26:50,INT-16850/16,"parkowanie na trawniku, niszczenie roślinności + 1 pojazd na chodniku - brak 1,5m",NIEPRAWIDŁOWE PARKOWANIE,BAJANA 23-31/,,0,2016-05-04 21:25:44
2016-05-04 22:51:53,INT-16861/16,Parkowanie za znakiem B-36,NIEPRAWIDŁOWE PARKOWANIE,BIAŁOWIESKA /,POUCZENIE,0,2016-05-04 22:51:56
2016-05-05 10:28:35,INT-16920/16,"NA PIERWSZYM PRZYSTANKU JADĄC OD UL. PIŁSUDSKIEGO ZAPARKOWANE POJAZDY, UTRUDNIONE WYSIADANIE Z AUTOBUSU",NIEPRAWIDŁOWE PARKOWANIE,ZIELIŃSKIEGO /,,100,2016-05-05 12:27:08
2016-05-05 10:37:51,INT-16921/16,"PARKOWANIE ZA D-40 W MIEJSCU NIE WYZNACZONYM, UL. ESTOŃSKA 44 PARKOWANIE NA CHODNIKU BRAK 1,5 M, UL. sTZREGOMSKA/ESTOŃSKA HANDEL, UL. STRZEGOMSKA 272-296 PARKOWANIE ZA B-35",NIEPRAWIDŁOWE PARKOWANIE,STRZEGOMSKA 202/,,100,2016-05-05 12:46:51
2016-05-05 10:37:51,INT-16921/16,"PARKOWANIE ZA D-40 W MIEJSCU NIE WYZNACZONYM, UL. ESTOŃSKA 44 PARKOWANIE NA CHODNIKU BRAK 1,5 M, UL. sTZREGOMSKA/ESTOŃSKA HANDEL, UL. STRZEGOMSKA 272-296 PARKOWANIE ZA B-35",NIEPRAWIDŁOWE PARKOWANIE,STRZEGOMSKA 202/,,0,2016-05-05 12:46:51
2016-05-05 10:46:58,INT-16923/16,WEDŁUG OSOBY ZGŁASZAJĄCEJ SĄSIAD WYLEWA SZAMBO NA OGRÓD (ROBI TO NIE PO RAZ PIERWSZY),PORZĄDKOWA,TRZMIELOWICKA 45/,MANDAT,400,2016-05-13 06:22:04
2016-05-05 10:54:08,INT-16924/16,Parkowanie za B-36,BLOKADA,ŚW.ANTONIEGO /,,100,2016-05-05 10:55:50
2016-05-05 10:54:08,INT-16924/16,Parkowanie za B-36,BLOKADA,ŚW.ANTONIEGO /,,0,2016-05-05 10:55:50
2016-05-05 11:00:35,INT-16925/16,Nieprzestrzeganie sygnalizatora S-5 przejście na czerwonym świetle,WYKROCZENIA PIESZYCH,PLAC LEGIONÓW /,,100,2016-05-05 11:00:45
2016-05-05 11:02:47,INT-16927/16,"KOZANOWSKA 28 HANDEL + NISZCZENIE ROŚLINNOŚCI, KOZANOWSKA A PILCZYCKA PRZY BIEDRONCE HANDEL",HANDEL,KOZANOWSKA /,MANDAT,100,2016-05-05 14:42:12
2016-05-05 11:57:03,INT-16938/16,VIS A VIS HOTELU SOFITEL POSTÓJ POJAZDÓW NA DRODZE DLA ROWERÓW,NIEPRAWIDŁOWE PARKOWANIE,ŚW. MIKOŁAJA /,,0,2016-05-05 12:30:04
2016-05-05 12:00:23,INT-16939/16,Handel na terenie Paru Kulturowego bez zezwolenia ul. Oławska,HANDEL,OŁAWSKA /,MANDAT,100,2016-05-05 12:00:34
2016-05-05 12:35:10,INT-16946/16,handel na terenie gminy ,HANDEL,JEMIOŁOWA /,MANDAT,50,2016-05-05 12:37:36
2016-05-05 12:42:25,INT-16948/16,Kontrola parkowania ul. Włodkowica za B-36. 1 kierujący ukarany MKK 100 zł1 kierujący otrzymał wezwanie  na przesłuchanie na ul Gwarną 5/7,BLOKADA,WŁODKOWICA /,SĄD,100,2016-05-05 12:42:34
2016-05-05 12:42:25,INT-16948/16,Kontrola parkowania ul. Włodkowica za B-36. 1 kierujący ukarany MKK 100 zł1 kierujący otrzymał wezwanie  na przesłuchanie na ul Gwarną 5/7,BLOKADA,WŁODKOWICA /,SĄD,0,2016-05-05 12:42:34
2016-05-05 13:07:09,INT-16951/16,POSTÓJ POJAZDU ZA B-36 PO OBU STRONACH,NIEPRAWIDŁOWE PARKOWANIE,WŁODKOWICA /,,100,2016-05-05 14:29:43
2016-05-05 13:07:09,INT-16951/16,POSTÓJ POJAZDU ZA B-36 PO OBU STRONACH,NIEPRAWIDŁOWE PARKOWANIE,WŁODKOWICA /,,0,2016-05-05 14:29:43
2016-05-05 13:08:42,INT-16952/16,Parkowanie za B-36,BLOKADA,CIESZYŃSKIEGO /,,100,2016-05-05 13:08:45
2016-05-05 13:08:42,INT-16952/16,Parkowanie za B-36,BLOKADA,CIESZYŃSKIEGO /,,0,2016-05-05 13:08:45
2016-05-05 15:31:25,INT-16979/16,a PAWŁOWA PARKOWANIE NA JEZDNI - UTRUDNIENIE RUHUG. 14.42 ,NIEPRAWIDŁOWE PARKOWANIE,PIŁSUDSKIEGO /,,0,2016-05-05 17:58:26
2016-05-05 15:40:23,INT-16981/16,a Łęczycka - parkowanie na skrzyżowaniu,BLOKADA,LITOMSKA /,,0,2016-05-05 15:40:57
2016-05-05 15:46:02,INT-16982/16,Parkowanie za B36,BLOKADA,CYBULSKIEGO /,,100,2016-05-05 15:47:03
2016-05-05 15:46:02,INT-16982/16,Parkowanie za B36,BLOKADA,CYBULSKIEGO /,,0,2016-05-05 15:47:03
2016-05-05 15:51:30,INT-16983/16,a Cybulskiego parkowanie na skrzyzowaniu,BLOKADA,POMORSKA /,,100,2016-05-05 15:52:54
2016-05-05 16:08:02,INT-16985/16,parkowanie na moście Pomorskim,BLOKADA,POMORSKA /,,0,2016-05-05 16:08:14
2016-05-05 16:10:25,INT-16986/16,parkowanie na powierzchni wyłączonej z ruchu,BLOKADA,BOGUSŁAWSKIEGO /,,100,2016-05-05 16:10:43
2016-05-05 16:10:25,INT-16986/16,parkowanie na powierzchni wyłączonej z ruchu,BLOKADA,BOGUSŁAWSKIEGO /,,0,2016-05-05 16:10:43
2016-05-05 16:12:20,INT-16987/16,parkowanie za B-36,BLOKADA,ZAPOLSKIEJ /,,100,2016-05-05 16:12:33
2016-05-05 16:51:40,INT-16991/16,na czwartej działce od ul. Birmańskiej wypalanie odpadów,"WYPALANIE, OGNISKO",MOŚCICKIEGO /,MANDAT,250,2016-05-13 06:22:30
2016-05-05 17:42:38,INT-16996/16,PARKOWANIE ZA B-36 NA TERENIE OSIEDLA,NIEPRAWIDŁOWE PARKOWANIE,KAMIEŃSKIEGO 227/,,100,2016-05-05 19:46:41
2016-05-05 17:52:58,INT-16997/16,"Kontrola parkowania za B-36, T-24",NIEPRAWIDŁOWE PARKOWANIE,WITA STWOSZA /,POUCZENIE,0,2016-05-05 17:57:14
2016-05-05 18:26:27,INT-17001/16,Kontrola handlu w Rynku,HANDEL,RYNEK 55/57/,MANDAT,50,2016-05-05 18:30:31
2016-05-05 18:33:02,INT-17002/16,Kontrola parkowania w godz.18:05- 19:35 na ul. Antoniego za znakiem zakaz zatrzymywania.,NIEPRAWIDŁOWE PARKOWANIE,ANTONIEGO 14/,POUCZENIE,0,2016-05-05 18:35:45
2016-05-05 18:41:18,INT-17004/16,PARKOWANIE W ODLEGŁOŚCI MNIEJSZEJ NIŻ 10 METRÓW OD PRZEJŚCIA DLA PIESZYCH ORAZ NA POWIERZCHNI WYŁĄCZONEJ Z RUCHU,BLOKADA,WŁODKOWICA /,,100,2016-05-05 18:41:32
2016-05-05 18:52:37,INT-17007/16,Kontrola na terenie Gminy bez zezwolenia,HANDEL,OŁAWSKA /,MANDAT,50,2016-05-05 18:52:48
2016-05-05 18:56:40,INT-17008/16,LOKATOR Z MIESZKANIA OLSZEWSKIEGO 28/2 WYWALIŁ NA TEREN PODWÓRZA ODPADY POREMONTOWE. ,PORZĄDKOWA,OLSZEWSKIEGO 28/,,0,2016-05-13 06:22:57
2016-05-05 19:34:32,INT-17010/16,parkowanie za b-36,BLOKADA,ZAPOROSKA /,,100,2016-05-05 19:34:46
2016-05-05 19:34:32,INT-17010/16,parkowanie za b-36,BLOKADA,ZAPOROSKA /,,0,2016-05-05 19:34:46
2016-05-05 20:03:17,INT-17015/16,kontrola parkowania pojazdów za b-36 ,NIEPRAWIDŁOWE PARKOWANIE,DŁUGOPOLSKA /,MANDAT,100,2016-05-05 20:04:59
2016-05-05 20:09:00,INT-17016/16,stoisko z owocami,HANDEL,MOŚCICKIEGO /,MANDAT,50,2016-05-05 20:11:30
2016-05-05 20:13:38,INT-17017/16,Kontrola parkowania pojazdów w miejscu obowiązywania znaku B36,NIEPRAWIDŁOWE PARKOWANIE,PSIE BUDY /,MANDAT,100,2016-05-05 20:13:47
2016-05-05 22:03:10,INT-17022/16,spozywanie alkoholu w miejscu publicznym,SPOŻYWANIE ALKOHOLU,ŻERNICKA /,MANDAT,100,2016-05-05 22:03:46
2016-05-05 22:03:10,INT-17022/16,spozywanie alkoholu w miejscu publicznym,SPOŻYWANIE ALKOHOLU,ŻERNICKA /,MANDAT,0,2016-05-05 22:03:46
2016-05-05 22:24:21,INT-17026/16,Palenie na przystanku MPK,PALENIE TYTONIU W MIEJSCACH  ZABRONIONYCH,PŁOŃSKIEGO /,POUCZENIE,50,2016-05-05 22:31:17
2016-05-05 22:44:37,INT-17027/16,Parkowanie na P-21,NIEPRAWIDŁOWE PARKOWANIE,BIAŁOWIESKA /,MANDAT,100,2016-05-05 22:44:58
2016-05-05 22:52:58,INT-17028/16,Palenie na przystanku MPk,PALENIE TYTONIU W MIEJSCACH  ZABRONIONYCH,LOTNICZA /,MANDAT,300,2016-05-05 22:53:12
2016-05-05 23:00:46,INT-17029/16,P_rzejscie przez jezdnie w miejscu niewyznaczonym,WYKROCZENIA PIESZYCH,LOTNICZA /,POUCZENIE,0,2016-05-05 23:01:05
2016-05-05 23:02:49,INT-17030/16,"mężczyzna spożywającyc alkohol w miejscu zabronionym, używa słów wulgarnych (przeklina) oraz zanieczyszcza miejsce publiczne",SPOŻYWANIE ALKOHOLU,KOWALSKA /,,500,2016-05-05 23:04:04
2016-05-05 23:02:49,INT-17030/16,"mężczyzna spożywającyc alkohol w miejscu zabronionym, używa słów wulgarnych (przeklina) oraz zanieczyszcza miejsce publiczne",SPOŻYWANIE ALKOHOLU,KOWALSKA /,,100,2016-05-05 23:04:04
2016-05-05 23:11:57,INT-17031/16,PALENIE TYTONIU W MIEJSCU ZABRONIONYM (PLAC ZABAW) I SPOŻYWANIE ALKOHOLU W MIEJSCU ZABRONIONYM,PALENIE TYTONIU W MIEJSCACH  ZABRONIONYCH,JAGIELOŃCZYKA /,,500,2016-05-05 23:13:00
2016-05-05 23:11:57,INT-17031/16,PALENIE TYTONIU W MIEJSCU ZABRONIONYM (PLAC ZABAW) I SPOŻYWANIE ALKOHOLU W MIEJSCU ZABRONIONYM,PALENIE TYTONIU W MIEJSCACH  ZABRONIONYCH,JAGIELOŃCZYKA /,,100,2016-05-05 23:13:00
2016-05-05 23:16:54,INT-17034/16,NIE STOSOWANIE SIĘ DO ZNAKU B-1,BEZPIECZEŃSTWO W KOMUNIKACJI,MOST MŁYŃSKI /,,50,2016-05-05 23:17:36
2016-05-05 23:16:54,INT-17034/16,NIE STOSOWANIE SIĘ DO ZNAKU B-1,BEZPIECZEŃSTWO W KOMUNIKACJI,MOST MŁYŃSKI /,,100,2016-05-05 23:17:36
2016-05-05 23:25:30,INT-17033/16,Parkowanie za znakiem b-36,NIEPRAWIDŁOWE PARKOWANIE,BIAŁOWIESKA /,MANDAT,100,2016-05-05 23:25:46
2016-05-05 23:52:27,INT-17039/16,Parkowanie za b-36,NIEPRAWIDŁOWE PARKOWANIE,BIAŁOWIESKA /,MANDAT,100,2016-05-05 23:52:37
2016-05-06 00:29:34,INT-17040/16,2 pojazdy na trawniku.,NISZCZENIE ZIELENI,BAJANA 27-31/,,100,2016-05-06 03:03:45
2016-05-06 07:35:36,INT-17065/16,Spalanie odpadów w ognisku.,PORZĄDKOWA,KAMIENNOGÓRSKA /,MANDAT,200,2016-05-06 07:35:47
2016-05-06 08:14:42,INT-17068/16,"Czarny Opel zaparkowany w sposó utrudniający wyjazd z garażu oraz za B-36 + brak 1,5m na chodniku.",NIEPRAWIDŁOWE PARKOWANIE,BAJANA 37A/,,0,2016-05-06 09:23:44
2016-05-06 08:50:05,INT-17077/16,"Ulica oraz Mosty Mieszczańskie, pojazdy za B-1, na trawnikach + brak 1,5m na chodnikach.",NIEPRAWIDŁOWE PARKOWANIE,MIESZCZAŃSKA /,,100,2016-05-06 22:57:49
2016-05-06 08:50:05,INT-17077/16,"Ulica oraz Mosty Mieszczańskie, pojazdy za B-1, na trawnikach + brak 1,5m na chodnikach.",NIEPRAWIDŁOWE PARKOWANIE,MIESZCZAŃSKA /,,50,2016-05-06 22:57:49
2016-05-06 08:59:04,INT-17079/16,przy Legnickiej - parkowanie pojazdów na postoju Taxi,NIEPRAWIDŁOWE PARKOWANIE,NIEDŹWIEDZIA /,,100,2016-05-06 10:11:55
2016-05-06 09:13:34,INT-17085/16,NISZCZENIE ROŚLINNOŚCI,NISZCZENIE ZIELENI,GORLICKA /,,50,2016-05-25 04:49:22
2016-05-06 09:13:34,INT-17085/16,NISZCZENIE ROŚLINNOŚCI,NISZCZENIE ZIELENI,GORLICKA /,,0,2016-05-25 04:49:22
2016-05-06 09:13:34,INT-17085/16,NISZCZENIE ROŚLINNOŚCI,NISZCZENIE ZIELENI,GORLICKA /,,100,2016-05-25 04:49:22
2016-05-06 09:13:43,INT-17084/16,"Od ul. Na Ostatnim Groszu do ronda przy Astrze pojazdy na chodniku, brak 1,5m.",NIEPRAWIDŁOWE PARKOWANIE,SZYBOWCOWA /,,100,2016-05-06 19:51:52
2016-05-06 09:28:36,INT-17088/16,parkowanie pojazdów w Strefie poza miejscami wyznaczonymi,NIEPRAWIDŁOWE PARKOWANIE,STRZEGOMSKA 202/,,0,2016-05-06 13:18:20
2016-05-06 09:33:07,INT-17090/16,a Estońska handel w pasie drogowym,HANDEL,STRZEGOMSKA /,MANDAT,100,2016-05-06 10:10:52
2016-05-06 09:36:47,INT-17092/16,od Francuskiej przy POD parkowanie pojazdów w strefie zamieszkania poza miejscami wyznaczonymi,NIEPRAWIDŁOWE PARKOWANIE,KLECIŃSKA /,,100,2016-05-06 16:29:57
2016-05-06 09:36:47,INT-17092/16,od Francuskiej przy POD parkowanie pojazdów w strefie zamieszkania poza miejscami wyznaczonymi,NIEPRAWIDŁOWE PARKOWANIE,KLECIŃSKA /,,0,2016-05-06 16:29:57
2016-05-06 09:47:01,INT-17095/16,"Nieuprawnione pojazdy na postoju taxi oraz naprzeciw, brak 1,5m na chodniku.",NIEPRAWIDŁOWE PARKOWANIE,BERNARDYŃSKA /,,100,2016-05-06 11:11:17
2016-05-06 09:55:20,INT-17096/16,"..a Sokolnicza, pojazdy zparkowane na skrzyżowaniu utrudniają ruch autobusom MPK, które mają tam pętlę.",NIEPRAWIDŁOWE PARKOWANIE,SIKORSKIEGO /,WEZWANIE,0,2016-05-06 12:49:19
2016-05-06 10:00:35,INT-17097/16,pojazdy za B36,NIEPRAWIDŁOWE PARKOWANIE,ZAPOLSKA /,MANDAT,100,2016-05-06 10:00:37
2016-05-06 10:24:25,INT-17103/16,przy Poniatowskiego parkowanie pojazdów ciężarowych za znakiem zakazu,NIEPRAWIDŁOWE PARKOWANIE,PRUSA /,MANDAT,100,2016-05-06 23:35:30
2016-05-06 10:32:14,INT-17104/16,Parkowanie za B-36 i T-24,NIEPRAWIDŁOWE PARKOWANIE,BOGUSŁAWSKIEGO /,MANDAT,100,2016-05-06 10:32:42
2016-05-06 10:46:32,INT-17110/16,przy PKO handel truskawkami,HANDEL,PERECA /,,0,2016-05-06 16:01:10
2016-05-06 10:47:10,INT-17111/16,na terenie osiedla Lokum da Vinci - parkowanie pojazdów w miejscu niewyznaczonym,NIEPRAWIDŁOWE PARKOWANIE,BULWAR DEDALA 2/16/,,100,2016-05-06 13:03:27
2016-05-06 10:47:10,INT-17111/16,na terenie osiedla Lokum da Vinci - parkowanie pojazdów w miejscu niewyznaczonym,NIEPRAWIDŁOWE PARKOWANIE,BULWAR DEDALA 2/16/,,0,2016-05-06 13:03:27
2016-05-06 10:55:19,INT-17115/16,Pojazd na P-21 oraz niezgodnie z oznakowaniem T-30,NIEPRAWIDŁOWE PARKOWANIE,PLAC MUZEALNY /,MANDAT,100,2016-05-06 10:55:34
2016-05-06 10:57:21,INT-17116/16,przy Arkadach Wrocławskich zablokowany wyjazd z miejsca parkingowego,NIEPRAWIDŁOWE PARKOWANIE,NASYPOWA /,,100,2016-05-06 11:13:39
2016-05-06 10:58:33,INT-17149/16,pojazdy za B36.,NIEPRAWIDŁOWE PARKOWANIE,PRETFICZA /,MANDAT,0,2016-05-06 11:00:05
2016-05-06 11:01:48,INT-17118/16,a Dworcowa parkowanie pojazdu Nissan  na chodniku za słupkami,NIEPRAWIDŁOWE PARKOWANIE,KOŚCIUSZKI /,,0,2016-05-06 12:15:02
2016-05-06 11:02:59,INT-17119/16,przejście podziemne -  handel,HANDEL,PLAC STRZEGOMSKI /,MANDAT,50,2016-05-06 12:37:56
2016-05-06 11:03:38,INT-17121/16,Dwa nielegalne stoiska handlowe z nielegalizowanymi wagami:- Kozanowska 28 stoisko z truskawkami- Kozanowska/Pilczycka - owoce warzywa,HANDEL,KOZANOWSKA /,MANDAT,100,2016-05-06 16:46:03
2016-05-06 11:08:31,INT-17120/16,"a łąkowa,na skrzyzowaniu 1 pojazd.",NIEPRAWIDŁOWE PARKOWANIE,KOŚCIUSZKI /,MANDAT,300,2016-05-06 11:09:03
2016-05-06 11:10:19,INT-17122/16,Pojazd na p21.,NIEPRAWIDŁOWE PARKOWANIE,BAŁUCKIEGO /,MANDAT,100,2016-05-06 11:10:21
2016-05-06 11:13:29,INT-17123/16,Pojazd na kopercie dla rzecznika prasowego.,NIEPRAWIDŁOWE PARKOWANIE,WIERZBOWA /,MANDAT,0,2016-05-06 11:13:36
2016-05-06 11:17:22,INT-17124/16,Pojazd na postoju taxi bez uprawnien.,NIEPRAWIDŁOWE PARKOWANIE,KOMANDORSKA /,MANDAT,100,2016-05-06 11:17:31
2016-05-06 11:17:22,INT-17124/16,Pojazd na postoju taxi bez uprawnien.,NIEPRAWIDŁOWE PARKOWANIE,KOMANDORSKA /,MANDAT,0,2016-05-06 11:17:31
2016-05-06 11:21:48,INT-17126/16,Na kopercie dla osoby niepełnosprawnej parkuje pojazd bez uprawnień,NIEPRAWIDŁOWE PARKOWANIE,WEIGLA /,MANDAT,500,2016-05-06 11:23:42
2016-05-06 12:29:23,INT-17142/16,parkowanie pojazdów za B-36,NIEPRAWIDŁOWE PARKOWANIE,WŁODKOWICA /,,100,2016-05-06 15:06:21
2016-05-06 12:29:23,INT-17142/16,parkowanie pojazdów za B-36,NIEPRAWIDŁOWE PARKOWANIE,WŁODKOWICA /,,0,2016-05-06 15:06:21
2016-05-06 12:31:36,INT-17144/16,Parkowanie w strefie zamieszkania poza miejscem wyznaczonym ul. Styki i Kossaka,NIEPRAWIDŁOWE PARKOWANIE,STYKI I KOSSAKA /,MANDAT,100,2016-05-06 12:31:39
2016-05-06 12:34:13,INT-17143/16,Witam państwa. Proszę o usunięcie pojazdu z ulicy grunwaldziej 18 wiza wi sklepu z akumulatorami. Proszę o pilną interwencję pojazd blokuje chodnik do polskiego związku niewidomych.  ,NIEPRAWIDŁOWE PARKOWANIE,GRUNWALDZKA 18/,MANDAT,100,2016-05-08 23:53:40
2016-05-06 13:16:36,INT-17151/16,Pojazdy za B36.,NIEPRAWIDŁOWE PARKOWANIE,KOMANDORSKA /,MANDAT,0,2016-05-06 13:16:46
2016-05-06 13:28:58,INT-17156/16,Kontrola ruchu pojazdów za B1,BEZPIECZEŃSTWO W KOMUNIKACJI,MOSTY MŁYŃSKIE /,MANDAT,50,2016-05-06 13:29:01
2016-05-06 14:50:02,INT-17174/16,"Kontrola Rynku z uwagą na zaśmiecanie, zanieczyszczanie",PORZĄDKOWA,RYNEK /,MANDAT,100,2016-05-06 14:50:19
2016-05-06 14:54:56,INT-17175/16,Kontrola handlu na terenie Gminy bez zezwolenia,HANDEL,SKARBOWCÓW /,MANDAT,50,2016-05-06 14:55:13
2016-05-06 15:00:22,INT-17176/16,Pojazdy w podwórzu za D-40.,NIEPRAWIDŁOWE PARKOWANIE,LEGNICKA 17/,,100,2016-05-06 15:27:14
2016-05-06 15:00:22,INT-17176/16,Pojazdy w podwórzu za D-40.,NIEPRAWIDŁOWE PARKOWANIE,LEGNICKA 17/,,0,2016-05-06 15:27:14
2016-05-06 15:59:49,INT-17188/16,parkowanie za B-36,BLOKADA,FRYDERYKA JOLIOT-CURIE /,,100,2016-05-06 16:00:13
2016-05-06 15:59:49,INT-17188/16,parkowanie za B-36,BLOKADA,FRYDERYKA JOLIOT-CURIE /,,0,2016-05-06 16:00:13
2016-05-06 16:06:16,INT-17189/16,parkowanie za B-36,BLOKADA,KOMANDORSKA /,MANDAT,100,2016-05-06 16:06:32
2016-05-06 16:07:34,INT-17190/16,Pojazdy za B-36 oraz poniżej 10m od skrzyżowania z ul. Ruską i Kiełbaśniczą.,NIEPRAWIDŁOWE PARKOWANIE,PLAC SOLNY /,WEZWANIE,0,2016-05-06 16:48:58
2016-05-06 19:38:25,INT-17217/16,"Róg Więziennej, zgłaszający nie może wjechać na podwórze Rynek 53, gdyż przejazd blokują pojazdy na ul. Igielnej.",NIEPRAWIDŁOWE PARKOWANIE,IGIELNA /,,100,2016-05-06 20:22:38
2016-05-06 19:38:37,INT-17215/16,a Nowodworska nieprawidłowe parkowanie pojazdów na chodniku utrudnianie ruchu pieszego - zgłaszała kobieta idąca z wózkiem,NIEPRAWIDŁOWE PARKOWANIE,BUDZISZYŃSKA /,,0,2016-05-06 21:44:16
2016-05-06 20:18:59,INT-17221/16,Kontrola za znakiem b1,BEZPIECZEŃSTWO W KOMUNIKACJI,SZEWSKA /,MANDAT,100,2016-05-06 20:19:11
2016-05-06 20:18:59,INT-17221/16,Kontrola za znakiem b1,BEZPIECZEŃSTWO W KOMUNIKACJI,SZEWSKA /,MANDAT,50,2016-05-06 20:19:11
2016-05-06 20:21:24,INT-17222/16,Kontrola parkowania za znakiem b36 + t24,NIEPRAWIDŁOWE PARKOWANIE,SZEWSKA /,MANDAT,100,2016-05-06 20:21:33
