2018-07-24 15:11:31,INT-29304/18,parkowanie pojazdów za B-36.,NIEPRAWIDŁOWE PARKOWANIE,ZYNDRAMA Z MASZKOWIC 16/,100,,2018-07-24 15:55:27
2018-07-24 17:40:00,INT-29456/18,Kontrola spożywania alkoholu,SPOŻYWANIE ALKOHOLU,WYSPA SŁODOWA /,MANDAT,50,2018-07-25 18:36:34
2018-07-24 17:40:00,INT-29456/18,Kontrola spożywania alkoholu,SPOŻYWANIE ALKOHOLU,WYSPA SŁODOWA /,MANDAT,100,2018-07-25 18:36:34
2018-07-24 18:01:15,INT-29327/18,A Stabłowicka  od strony Parku Stabłowickiego zaparkowane na zakazie srebrne BMW - pod spodem plama oleju.,NIEPRAWIDŁOWE PARKOWANIE,GÓRECKA /,0,,2018-07-24 18:32:32
2018-07-24 18:15:00,INT-29615/18,spożywanie alkoholu w mkiejscu publicznym ,SPOŻYWANIE ALKOHOLU,WYSPA SŁODOWA /,MANDAT,100,2018-07-27 07:10:59
2018-07-24 21:11:46,INT-29341/18,parkowanie na postoju Taxi pojazdy nieuprawnione,NIEPRAWIDŁOWE PARKOWANIE,WŁODKOWICA /,100,,2018-07-24 23:48:34
2018-07-24 21:11:46,INT-29341/18,parkowanie na postoju Taxi pojazdy nieuprawnione,NIEPRAWIDŁOWE PARKOWANIE,WŁODKOWICA /,0,,2018-07-24 23:48:34
2018-07-25 00:08:00,INT-29357/18,"a Wietrzna, pojazdy parkują w miejscu zakazu zatrzymywania się.",NIEPRAWIDŁOWE PARKOWANIE,SKARBOWCÓW /,100,,2018-07-25 09:00:42
2018-07-25 00:08:00,INT-29357/18,"a Wietrzna, pojazdy parkują w miejscu zakazu zatrzymywania się.",NIEPRAWIDŁOWE PARKOWANIE,SKARBOWCÓW /,0,,2018-07-25 09:00:42
2018-07-25 05:54:41,INT-29350/18,parkowanie pojazdów za B-36,NIEPRAWIDŁOWE PARKOWANIE,KAZIMIERZA WIELKIEGO /,100,,2018-07-25 05:57:27
2018-07-25 08:28:16,INT-29362/18,NIEPRAWIDŁOWE PARKOWANIE,CYNAMONOWA /,,0,,2018-07-25 08:28:51
2018-07-25 09:31:34,INT-29372/18,na całej długości ulicy pojazdy parkujące za B-36,NIEPRAWIDŁOWE PARKOWANIE,WIERZBOWA /,0,,2018-07-25 12:28:27
2018-07-25 09:35:38,INT-29373/18,"po Rynku poruszał się kierowca Renault, który nie ma żadnych dokumentów na pojazd i uprawnień.",ZDARZENIE DROGOWE,RYNEK /,MANDAT,50,2018-07-25 10:47:24
2018-07-25 09:36:21,INT-29374/18,znacznie zanieczyszczona jezdnia i okoliczny teren przez pojazdy ciężarowe wywożące rozkruszony gruz z pobliskiej firmy,PORZĄDKOWA,MŁYNARSKA /,MANDAT,200,2018-07-25 10:41:59
2018-07-25 10:20:00,INT-29448/18,Parkowanie za B-36,BLOKADA,SIKORSKIEGO /,100,,2018-07-25 17:59:54
2018-07-25 10:20:00,INT-29448/18,Parkowanie za B-36,BLOKADA,SIKORSKIEGO /,0,,2018-07-25 17:59:54
2018-07-25 10:25:00,INT-29408/18,Zgłoszenie inspektorów Zdium dotyczące niezabezpieczonych prac w pasie drogowy,BEZPIECZEŃSTWO W KOMUNIKACJI,SZARSKIEGO /,MANDAT,100,2018-07-25 12:40:12
2018-07-25 10:50:41,INT-29386/18,"ul. Kopernika parkowanie na trawniku, niszczenie roślinnpości",NISZCZENIE ZIELENI,KOPERNIKA MIKOŁAJA /,0,,2018-07-26 00:51:44
2018-07-25 11:00:00,INT-29619/18,B1,BEZPIECZEŃSTWO W KOMUNIKACJI,MOSTY MŁYŃSKIE /,100,,2018-07-27 07:28:33
2018-07-25 11:09:39,INT-29393/18,"postój pojazdu na trawniku, wystawiono 2 x zk",NISZCZENIE ZIELENI,KRZEMIENIECKA 116/,WEZWANIE,50,2018-07-25 11:13:59
2018-07-25 11:09:39,INT-29393/18,"postój pojazdu na trawniku, wystawiono 2 x zk",NISZCZENIE ZIELENI,KRZEMIENIECKA 116/,WEZWANIE,0,2018-07-25 11:13:59
2018-07-25 11:30:00,INT-29949/18,Handel kwiatami na terenie gminy,HANDEL,SKARBOWCÓW /,MANDAT,50,2018-07-30 17:38:29
2018-07-25 11:40:00,INT-29410/18,Niestosowanie się do sygnalizatora S-5,BEZPIECZEŃSTWO W KOMUNIKACJI,ŚREDZKA /,POUCZENIE,0,2018-07-25 12:45:08
2018-07-25 11:40:00,INT-30329/18,Parkowanie pojazdu na przejściu dla pieszych. Podczas interwencj mężczyzna chciał odjechać i uderzył w zaparkowany za nim pojazd marki  HONDA. Wezwana na miejsce Policja.,NIEPRAWIDŁOWE PARKOWANIE,NIEMCEWICZA /,SĄD,0,2018-08-02 18:35:52
2018-07-25 12:05:49,INT-29398/18,parkowanie za b-36,NIEPRAWIDŁOWE PARKOWANIE,MALARSKA 19/,0,,2018-07-25 12:05:58
2018-07-25 12:18:23,INT-29402/18,parkowanie za D-40ul. Na Grobli,NIEPRAWIDŁOWE PARKOWANIE,NA GROBLI /,0,,2018-07-25 12:18:28
2018-07-25 12:30:00,INT-29628/18,a ul. Odrzańska - nagabywanie ,ZAKŁÓCANIE ŁADU I PORZĄDKU,RYNEK /,MANDAT,100,2018-07-27 08:20:20
2018-07-25 12:30:00,INT-29629/18,a ul. Odrzańska - nagabywanie ,ZAKŁÓCANIE ŁADU I PORZĄDKU,RYNEK /,MANDAT,100,2018-07-27 08:23:22
2018-07-25 12:34:07,INT-29406/18,"Brak 1,5 m. przejścia dla pieszych na chodniku",NIEPRAWIDŁOWE PARKOWANIE,MOŚCICKIEGO 33B/,0,,2018-07-25 12:34:12
2018-07-25 12:55:00,INT-29449/18,Parkowanie za B-36,BLOKADA,KRAWIECKA /,100,,2018-07-25 18:03:11
2018-07-25 12:59:12,INT-29413/18,Reklama w pasie drogowym bez zgody wymaganego zezwolenia.,PORZĄDKOWA,DŁUGA 39/,MANDAT,100,2018-08-29 15:45:36
2018-07-25 13:33:51,INT-29419/18,Parkjowanie pojazdów za B-36 i T-24,NIEPRAWIDŁOWE PARKOWANIE,ŁAZIENNA /,MANDAT,0,2018-07-25 15:55:51
2018-07-25 13:33:51,INT-29419/18,Parkjowanie pojazdów za B-36 i T-24,NIEPRAWIDŁOWE PARKOWANIE,ŁAZIENNA /,MANDAT,100,2018-07-25 15:55:51
2018-07-25 13:54:54,INT-29422/18,zaparkowane pojazdy na chodniku blokujące przejście ( vis a vis Przychodni ),NIEPRAWIDŁOWE PARKOWANIE,WIELKA 53/,MANDAT,100,2018-07-25 14:47:38
2018-07-25 14:45:00,INT-29454/18,Kontrola z uwagą na art 112- wyklejanki na witrynach,HANDEL,WITA STWOSZA /,MANDAT,300,2018-07-25 18:28:53
2018-07-25 16:00:00,INT-29452/18,Parkowanie za B-36 (do 15 minut),NIEPRAWIDŁOWE PARKOWANIE,KLIMASA /,0,,2018-07-25 18:23:09
2018-07-25 16:55:00,INT-29476/18,"A JĘCZMIENNA, KOŁO SKLEPU Z RTV W PASIE DROPGOWYM ZALEGAJĄ DWA POJEMNIKI OK. 20L Z PŁYNEM.NIEPRAWIDŁOWY POSTÓJ NA SKRZYZOWANIU, BRAK SŁUPKÓW WJEŻDŻAJĄ NA CHODNIK ",PORZĄDKOWA,GRABISZYŃSKA /,100,,2018-07-31 17:34:32
2018-07-25 16:55:00,INT-29476/18,"A JĘCZMIENNA, KOŁO SKLEPU Z RTV W PASIE DROPGOWYM ZALEGAJĄ DWA POJEMNIKI OK. 20L Z PŁYNEM.NIEPRAWIDŁOWY POSTÓJ NA SKRZYZOWANIU, BRAK SŁUPKÓW WJEŻDŻAJĄ NA CHODNIK ",PORZĄDKOWA,GRABISZYŃSKA /,0,,2018-07-31 17:34:32
2018-07-25 16:55:00,INT-29637/18,SPOŻYWANIE ALKOHOLU W MIEJCU PUBLICZNYM,SPOŻYWANIE ALKOHOLU,BULWAR XAWEREGO DUNIKOWSKIEGO /,MANDAT,100,2018-07-27 09:36:54
2018-07-25 17:30:00,INT-29627/18,niezastosowanie się do znaku B-1,BEZPIECZEŃSTWO W KOMUNIKACJI,SZEWSKA /,POUCZENIE,0,2018-07-27 08:18:01
2018-07-25 18:00:00,INT-29646/18,spożywanie alkoholu w miejscu piblicznym ,SPOŻYWANIE ALKOHOLU,SZEWSKA /,MANDAT,100,2018-07-27 10:34:45
2018-07-25 18:10:00,INT-29466/18,kontrola parkowania pojazdów w strefie zamieszkania w miejscu nie wyznaczonym ,NIEPRAWIDŁOWE PARKOWANIE,ŚWIĘTEGO ANTONIEGO /,MANDAT,0,2018-07-25 20:11:36
2018-07-25 18:10:00,INT-29466/18,kontrola parkowania pojazdów w strefie zamieszkania w miejscu nie wyznaczonym ,NIEPRAWIDŁOWE PARKOWANIE,ŚWIĘTEGO ANTONIEGO /,MANDAT,100,2018-07-25 20:11:36
2018-07-25 18:35:00,INT-29635/18,spożywanie alkoholou w miejscu publicznym ,SPOŻYWANIE ALKOHOLU,BULWAR XAWEREGO DUNIKOWSKIEGO /,MANDAT,100,2018-07-27 08:55:52
2018-07-25 20:00:00,INT-29469/18,Kontrola pod kątem spożywania alkoholu,SPOŻYWANIE ALKOHOLU,BULWAR XAWEREGO DUNIKOWSKIEGO /,MANDAT,100,2018-07-25 21:12:49
2018-07-25 22:24:45,INT-29478/18,vis a vis nr 50 parkowanie na zakazie ,NIEPRAWIDŁOWE PARKOWANIE,NYSKA /,100,,2018-07-25 23:16:51
2018-07-25 23:40:00,INT-29487/18,Parkowanie w strefie d40,NIEPRAWIDŁOWE PARKOWANIE,PL.UNIWERSYTECKI /,100,,2018-07-26 06:53:42
2018-07-26 06:37:26,INT-29484/18,kontrola gospodarki odpadami w punkcie usługowym,PORZĄDKOWA,SPÓŁDZIELCZA 1C/,MANDAT,100,2018-07-26 06:37:30
2018-07-26 06:46:12,INT-29485/18,pojazd VW zaparkowany za B-35,NIEPRAWIDŁOWE PARKOWANIE,BUDZISZYŃSKA 82/,WEZWANIE,0,2018-07-26 08:22:41
2018-07-26 08:26:45,INT-29504/18,"a ul. Szczecińska,przy myjni, parkowanie na całej szerokości chodnika- VW Golf.",NIEPRAWIDŁOWE PARKOWANIE,ŻERNICKA /,0,,2018-07-26 10:05:17
2018-07-26 08:43:11,INT-29511/18,"ul. Jemiołowa a ul. Grochowa, handel art. spożywczymi i art. przemysłowymi na chodnikach ",HANDEL,JEMIOŁOWA /,MANDAT,50,2018-07-30 12:57:46
2018-07-26 08:45:00,INT-29535/18,Spożywanie alkoholu w miejscu zabronionym,SPOŻYWANIE ALKOHOLU,RĘKODZIELNICZA 1/,MANDAT,100,2018-07-26 11:23:33
2018-07-26 09:03:52,INT-29514/18,ul. Buraczana na przeciw nr. 8 d zaparkowany pojazd na chodniku brak przejścia bus,NIEPRAWIDŁOWE PARKOWANIE,BURACZANA /,100,,2018-07-26 11:30:40
2018-07-26 09:15:00,INT-29543/18,Reklama w pasie drogowym,PLAKATY (REKLAMY),PARKOWA /,MANDAT,200,2018-07-26 17:53:29
2018-07-26 09:30:00,INT-29525/18,parkowanie w strefie zamieszkania poza miejscami wyznaczonymi do parkowania,NIEPRAWIDŁOWE PARKOWANIE,PRĄDZYŃSKIEGO 47-63/,100,,2018-07-26 09:58:48
2018-07-26 09:30:00,INT-29525/18,parkowanie w strefie zamieszkania poza miejscami wyznaczonymi do parkowania,NIEPRAWIDŁOWE PARKOWANIE,PRĄDZYŃSKIEGO 47-63/,0,,2018-07-26 09:58:48
2018-07-26 09:55:00,INT-29931/18,Parkowanie w strefie zamieszkania w miejscu niewyznaczonym,NIEPRAWIDŁOWE PARKOWANIE,RYNEK 33/,MANDAT,100,2018-07-30 16:44:36
2018-07-26 10:00:00,INT-29933/18,Handel na terenie Parku Kulturowego,HANDEL,OŁAWSKA /,MANDAT,200,2018-07-30 16:49:36
2018-07-26 10:00:00,INT-29529/18,parkowanie za B-36,BLOKADA,GRABISZYŃSKA 293/,0,,2018-07-26 10:48:40
2018-07-26 10:07:37,INT-29526/18,Plac Kromera przy kiosku ruchu na terenie miasta w miejscu nie wyznaczonym  rostawione stoisko z owocami ,HANDEL,PLAC KROMERA /,50,,2018-07-26 11:49:59
2018-07-26 10:45:00,INT-29548/18,reklama w pasie drogowym bez zgody,PLAKATY (REKLAMY),CURIE-SKŁODOWSKIEJ /,MANDAT,200,2018-07-26 17:51:30
2018-07-26 10:47:15,INT-29530/18,"restauracja Mai Lan, pracownicy podrzucają śmieci z lokalu do kontenerów mieszkańców.ZO.4042.549.2018.JR- SPRAWĘ PRZEKAZANO DO ODDZIAŁU WYKROCZEŃ.",PORZĄDKOWA,ŚW. WINCENTEGO 45/,SĄD REJONOWY,0,2018-08-09 15:03:17
2018-07-26 10:50:00,INT-29952/18,Parkowanie za B36,NIEPRAWIDŁOWE PARKOWANIE,PLAC SOLNY /,MANDAT,100,2018-07-30 18:02:15
2018-07-26 11:36:09,INT-29539/18,"D-40, parkowanie w miejscach niewyznaczonych.",NIEPRAWIDŁOWE PARKOWANIE,WALOŃSKA 11-13/,0,,2018-07-26 12:39:12
2018-07-26 11:40:00,INT-29951/18,Parkowanie za B36,NIEPRAWIDŁOWE PARKOWANIE,KURZY TARG /,MANDAT,100,2018-07-30 17:59:10
2018-07-26 11:48:08,INT-29542/18,niszczenie roślinności,NISZCZENIE ZIELENI,KRZEMIENIECKA 116/,0,,2018-07-26 11:48:35
2018-07-26 12:01:46,INT-29545/18,"a ul. Ruska, zablokowany wyjazd z miejsca parkingowego przez poj. m-ki Kia.",Zablokowany wyjazd,PSIE BUDY /,100,,2018-07-26 13:16:22
2018-07-26 12:15:00,INT-29953/18,Handel na terenie gminy,HANDEL,SKARBOWCÓW /,MANDAT,50,2018-07-30 18:09:10
2018-07-26 12:30:00,INT-29934/18,Nieprawidłowe parkowanie za b36,NIEPRAWIDŁOWE PARKOWANIE,SZEWSKA /,MANDAT,100,2018-07-30 16:52:25
2018-07-26 12:30:00,INT-29935/18,Nagabywanie,PLAKATY (REKLAMY),RYNEK /,MANDAT,200,2018-07-30 16:57:11
2018-07-26 12:50:40,INT-29553/18,"pomiędzy ul.Komandorska a ul.Drukarska, parkowanie na chodniku-brak 1.5m przejścia.",NIEPRAWIDŁOWE PARKOWANIE,WIELKA /,100,,2018-07-26 15:06:58
2018-07-26 15:50:00,INT-29569/18,Brak legalizacji wagi,HANDEL,JEMIOŁOWA /,MANDAT,50,2018-07-27 13:22:48
2018-07-26 15:50:00,INT-29660/18,Interwencja dotyczącą handlu przy ul. Jemiołowa,PORZĄDKOWA,JEMIOŁOWA /,MANDAT,50,2018-07-27 13:23:05
2018-07-26 16:00:00,INT-29571/18,"godz. 16.00 patrol zauważył pojazd porsche bez uprawnień na miejscu dla inwalidy. Godz. 16.10 patrol poprosił o wezwanie lawety.Na miejsce równocześnie z lawetą stawił sie kierowca pojazdu. Uiścił opłate za przyjazd holownika. Za wykroczenie noie przyjął mandatu, zostanie skierowany wniosek do sądu. Okazało się, że dodatkowo nie posiada ważnych badań technicznych pojazdu. Na miejsce wezwano patrol policji. W trakcie interwencji mężczyzna znieważył słownie jedną z funkcjonariuszek, co skutkowało przewiezieniem przez przybyły patrol policji  mężczyzny (decyzją dyż. KP Stare Miasto) do komisariatu, gdzie również udała się znieważona funkcjonariuszka. Tam prowadzone były dalsze czynności. Nakzano sporządzić dokumentację i przesłac do CK.Powiadomiono Kom.",NIEPRAWIDŁOWE PARKOWANIE,BISKUPIA /,0,,2018-07-26 22:53:00
2018-07-26 16:20:00,INT-29570/18,Brak zezwolenia na handel na tereni gminnym,HANDEL,JEMIOŁOWA /,MANDAT,50,2018-07-26 17:50:06
2018-07-26 16:25:00,INT-29671/18,kontrola parkowania pojazdów na chodniku nie przy krawędzi jezdni,NIEPRAWIDŁOWE PARKOWANIE,STRZEGOMSKA /,MANDAT,100,2018-07-27 14:35:26
2018-07-26 16:25:01,INT-29565/18,"parking Aquaparku, parkowanie pojazdów za B-36.",NIEPRAWIDŁOWE PARKOWANIE,BOROWSKA 99/,0,,2018-07-26 17:51:28
2018-07-26 16:30:00,INT-29940/18,Handel na terenie Parku Kulturowego,HANDEL,OŁAWSKA /,MANDAT,300,2018-07-30 17:07:21
2018-07-26 17:33:36,INT-29572/18,D-40 - parkowanie w miejscach niewyznaczonych.,NIEPRAWIDŁOWE PARKOWANIE,ZAKŁADOWA 7-9/,100,,2018-07-26 18:29:13
2018-07-26 17:33:36,INT-29572/18,D-40 - parkowanie w miejscach niewyznaczonych.,NIEPRAWIDŁOWE PARKOWANIE,ZAKŁADOWA 7-9/,0,,2018-07-26 18:29:13
2018-07-26 17:44:47,INT-29573/18,"parkowanie za B-36 + na trawniku,niszczenie zieleni.",NIEPRAWIDŁOWE PARKOWANIE,GWIAŹDZISTA 55/,0,,2018-07-26 18:10:06
2018-07-26 18:15:00,INT-29586/18,Spalania odpadów w ognisku. ,OGNISKO,PORĘBSKA 84/,MANDAT,500,2018-07-26 20:27:50
2018-07-26 18:30:00,INT-30024/18,b-36,NIEPRAWIDŁOWE PARKOWANIE,KRAWIECKA /,0,,2018-07-31 10:29:10
2018-07-26 18:35:00,INT-29938/18,Handel na terenie Parku Kulturowego,HANDEL,PRZEJŚCIE WINOGRONOWE /,MANDAT,100,2018-07-30 17:02:24
2018-07-26 20:34:48,INT-29587/18,postój Taxi - parkowanie pojazdów nieuprawnionych,NIEPRAWIDŁOWE PARKOWANIE,WŁODKOWICA /,100,,2018-07-26 21:36:27
2018-07-26 20:45:00,INT-29559/18,kontrola parkowania pojazdów za b-36 t-24 oraz w miejscu nie wyznaczonej w strefie zamieszkania ,NIEPRAWIDŁOWE PARKOWANIE,SZEWSKA /,MANDAT,100,2018-07-26 14:52:39
2018-07-26 21:50:00,INT-29611/18,Parkowanie w strefie D40,NIEPRAWIDŁOWE PARKOWANIE,ZAMKOWA /,100,,2018-07-27 06:37:54
2018-07-26 21:50:00,INT-29611/18,Parkowanie w strefie D40,NIEPRAWIDŁOWE PARKOWANIE,ZAMKOWA /,0,,2018-07-27 06:37:54
2018-07-26 22:06:03,INT-29594/18,kontrola parkowania za znakiem zakazu,NIEPRAWIDŁOWE PARKOWANIE,ŁAZIENNA /,100,,2018-07-26 23:43:02
2018-07-27 05:01:46,INT-29608/18,wjazd za B1.,NIEPRAWIDŁOWE PARKOWANIE,KURZY TARG /,100,,2018-07-27 05:03:23
2018-07-27 07:40:00,INT-29930/18,parkowanie za B36,NIEPRAWIDŁOWE PARKOWANIE,SZEWSKA /,MANDAT,100,2018-07-30 16:39:16
2018-07-27 08:07:54,INT-29623/18,parkowanie pojazdu przy oslonie śmietnikowej za D-40,NIEPRAWIDŁOWE PARKOWANIE,DRZEWNA 15/,100,,2018-07-27 09:15:01
2018-07-27 09:23:50,INT-29634/18,D40 parkowanie,NIEPRAWIDŁOWE PARKOWANIE,ŚW.ANTONIEGO 28/,0,,2018-07-27 09:23:54
2018-07-27 09:25:00,INT-30080/18,Parkowanie za B36,NIEPRAWIDŁOWE PARKOWANIE,ŚWIĘTEGO MIKOŁAJA /,POUCZENIE,0,2018-07-31 17:10:57
2018-07-27 10:05:00,INT-29950/18,"Nieprawidłowe parkowanie , utrudnie nie w ruchu",NIEPRAWIDŁOWE PARKOWANIE,POŁABIAN /,MANDAT,100,2018-07-30 17:43:25
2018-07-27 11:05:00,INT-29647/18,Kniaziewicza a Dworcowa parkowanie na skrzyzowaniu oraz na kontrapasie rowerowym,NIEPRAWIDŁOWE PARKOWANIE,KNIAZIEWICZA /,0,,2018-07-27 11:22:23
2018-07-27 12:00:00,INT-29928/18,Handel na terenie Parku Kulturowego,HANDEL,OŁAWSKA /,MANDAT,100,2018-07-30 16:31:10
2018-07-27 12:05:00,INT-29929/18,Brak uwidocznionej tabliczki informujacej o szkodliwości spożywania alkoholu,HANDEL,PLAC SOLNY /,MANDAT,150,2018-07-30 16:36:03
2018-07-27 12:05:00,INT-29860/18,W DNIU 27.07.2018R PODCZAS WSPÓLNEJ KONTROLI Z P.MARKIEM ŚLIWĄ STWIERDZONO REKLAME NA TERENIE OGRÓDKA GASTRONOMICZNEGO BEZ UZGODNIEŃ.NA OSOBĘ ODPOWIEDZIALNĄ NAŁOŻONO MKK/500 I ZOBOWIĄZANO W CIĄGU 7 DNI USUNĄĆ.,PLAKATY (REKLAMY),PL.SOLNY 18/19/,MANDAT,500,2018-07-30 07:09:57
2018-07-27 12:25:11,INT-29655/18,Wypalanie kabli w ognisku,PORZĄDKOWA,OSOBOWICKA /,MANDAT,100,2018-08-29 15:47:34
2018-07-27 12:47:43,INT-29661/18,Kontrola budowy wspólnie ze ZDIUMem,PORZĄDKOWA,KWIATKOWSKIEGO /,MANDAT,200,2018-07-27 23:31:04
2018-07-27 13:29:36,INT-29665/18,parkowanie pojazdów nie uprawnionych na postoju TAXI,NIEPRAWIDŁOWE PARKOWANIE,WŁODKOWICA /,100,,2018-07-27 16:24:11
2018-07-27 13:34:58,INT-29667/18,na wysokości Lidla - handel warzywa-owoce,HANDEL,WARMIŃSKA /,MANDAT,100,2018-07-27 16:13:16
2018-07-27 15:40:00,INT-29947/18,Parkowanie w miejscu zabronionym za B36,NIEPRAWIDŁOWE PARKOWANIE,WITA STWOSZA /,MANDAT,100,2018-07-30 17:29:59
2018-07-27 15:44:14,INT-29922/18,postój w strefie zamieszkania poza miejscem wyznaczinym,NIEPRAWIDŁOWE PARKOWANIE,ŚW.ANTONIEGO /,0,,2018-07-30 15:44:29
2018-07-27 15:57:22,INT-29923/18,postój na kopercie UMWSE ,NIEPRAWIDŁOWE PARKOWANIE,PL. SOLNY /,0,,2018-07-30 15:57:22
2018-07-27 16:10:00,INT-29955/18,Handel na terenie Parku Kulturowego,HANDEL,OŁAWSKA /,MANDAT,300,2018-07-30 18:17:01
2018-07-27 16:10:00,INT-29662/18,Handel na ternie gminy,PORZĄDKOWA,JEMIOŁOWA /,MANDAT,50,2018-07-27 13:23:23
2018-07-27 16:40:00,INT-29942/18,Nieprawidłowe parkowanie za B36,NIEPRAWIDŁOWE PARKOWANIE,SZEWSKA /,MANDAT,100,2018-07-30 17:13:01
2018-07-27 16:45:17,INT-29679/18,parkowanie za D-40,NIEPRAWIDŁOWE PARKOWANIE,TĘCZOWA 91/,100,,2018-07-27 17:59:51
2018-07-27 17:24:34,INT-29945/18,Zaśmiecenie miejsca publicznego,PORZĄDKOWA,ZAUŁEK GROTOWSKIEGO /,MANDAT,50,2018-07-30 17:25:37
2018-07-27 18:50:00,INT-29956/18,Wjazd za B1,BEZPIECZEŃSTWO W KOMUNIKACJI,SZEWSKA /,MANDAT,100,2018-07-30 18:19:48
2018-07-27 18:50:00,INT-29956/18,Wjazd za B1,BEZPIECZEŃSTWO W KOMUNIKACJI,SZEWSKA /,MANDAT,0,2018-07-30 18:19:48
2018-07-27 19:00:00,INT-30835/18,niezastosowanie się do b-1,NIEPRAWIDŁOWE PARKOWANIE,SZEWSKA /,0,,2018-08-08 10:21:10
2018-07-27 19:00:06,INT-29687/18,ul. Daszyńskiego a ul. Żeromskiego dwa pojazdy Mercedes i Citroen parkują na chodniku przy samym przejściu dla pieszych na skrzyżowaniu,NIEPRAWIDŁOWE PARKOWANIE,DASZYŃSKIEGO /,0,,2018-07-27 22:20:15
2018-07-27 19:30:00,INT-29959/18,Handel na terenie Parku Kulturowego,HANDEL,RYNEK /,MANDAT,100,2018-07-30 18:35:33
2018-07-27 19:45:00,INT-29699/18,Kontrola z uwagą na spożywanie alkoholu w miejscu publicznym,SPOŻYWANIE ALKOHOLU,BULWAR XAWEREGO DUNIKOWSKIEGO /,MANDAT,100,2018-07-27 21:15:40
2018-07-27 23:10:00,INT-29709/18,kontrola parkowania pojazdów na postoju TAXI,BLOKADA,WŁODKOWICA /,100,,2018-07-28 06:06:12
2018-07-28 00:10:00,INT-29710/18,kontrola parkowania poojazdów za B-36,BLOKADA,KAZIMIERZA WIELKIEGO /,100,,2018-07-28 06:08:23
2018-07-28 00:10:00,INT-29710/18,kontrola parkowania poojazdów za B-36,BLOKADA,KAZIMIERZA WIELKIEGO /,0,,2018-07-28 06:08:23
2018-07-28 11:08:24,INT-29733/18,na ogródku ktoś wylewa fekalia.,PORZĄDKOWA,PIERNIKOWA /,MANDAT,500,2018-07-28 12:18:43
2018-07-28 12:05:00,INT-29961/18,Handel na terenie Parku Kulturowego,HANDEL,RYNEK /,MANDAT,100,2018-07-30 18:39:00
2018-07-28 12:14:28,INT-29740/18,Na kopercie dla Konsulatu Indii zaparkowany sam. Volvo - nie uprawniony.,NIEPRAWIDŁOWE PARKOWANIE,WITA STWOSZA 18/,100,,2018-07-28 12:36:39
2018-07-28 14:42:29,INT-29749/18,"ul. Nożownicza od Łaciarskiej do Jodłowej parkowanie za zakazem zatrzymywania się z tablicą o odholowaniu pojazduul. Jodłowa parkowanie na chodnikach brak przejścia dla pieszych oraz na zakazie zatrzymywania się,",NIEPRAWIDŁOWE PARKOWANIE,NOŻOWNICZA /,0,,2018-07-28 16:47:31
2018-07-28 16:06:24,INT-29758/18,Postój TAXI pojazdy nie uprawnione.,NIEPRAWIDŁOWE PARKOWANIE,WŁODKOWICA /,0,,2018-07-28 17:28:50
2018-07-28 17:30:00,INT-29859/18,parkowanie za B36,NIEPRAWIDŁOWE PARKOWANIE,KAZIMIERZA WIELKIEGO /,100,,2018-07-30 07:06:49
2018-07-29 11:47:59,INT-29795/18,parkowanie pojazdów za znakiem zakazu,NIEPRAWIDŁOWE PARKOWANIE,ŁAZIENNA /,100,,2018-07-29 13:30:00
2018-07-29 11:59:36,INT-29796/18,utrudniony wjazd i wyjazd z petli autobusowej,NIEPRAWIDŁOWE PARKOWANIE,ROBOTNICZA /,WEZWANIE,0,2018-07-29 13:46:35
2018-07-29 12:04:31,INT-29797/18,Parkowanie za B-36 + T-24,NIEPRAWIDŁOWE PARKOWANIE,WYSTAWOWA /,LAWETA,100,2018-07-29 12:21:42
2018-07-29 12:10:00,INT-29962/18,Handel balonami na terenie Parku Kulturowego,HANDEL,RYNEK /,MANDAT,100,2018-07-30 18:42:12
2018-07-29 12:15:00,INT-30063/18,Handel na terenie Parku Kulturowego,HANDEL,RYNEK /,MANDAT,100,2018-07-31 15:49:31
2018-07-29 13:35:00,INT-30062/18,Handel balonami na terenie Parku Kulturowego,HANDEL,RYNEK /,MANDAT,100,2018-07-31 15:46:31
2018-07-29 13:40:00,INT-30061/18,Handel balonami na terenie Parku Kulturowego,HANDEL,RYNEK 42-43/,MANDAT,100,2018-07-31 15:37:12
2018-07-29 15:51:29,INT-29815/18,parkowanie za znakiem zakazu,NIEPRAWIDŁOWE PARKOWANIE,WYSTAWOWA /,100,,2018-07-29 15:52:52
2018-07-29 16:10:59,INT-29817/18,Parkowanie na kopercie dla osoby niepełnosprawnej bez uprawnień + B-1Dodatkowo 1 MKK 50zł.,NIEPRAWIDŁOWE PARKOWANIE,ALEJA DĄBSKA /,50,,2018-07-29 16:31:29
2018-07-29 16:20:38,INT-29818/18,Pomiędzy ul. Łaciarską a ul. Jodłową parkowanie pojazdów za B-36 z T24,NIEPRAWIDŁOWE PARKOWANIE,NOŻOWNICZA /,100,,2018-07-29 18:42:36
2018-07-29 16:40:00,INT-26849/18,handel w Parku Kulturowym bez zgody ,HANDEL,OŁAWSKA /,MANDAT,100,2018-07-02 16:17:57
2018-07-29 17:56:51,INT-29829/18,zaparkowane pojazdy ( jezdnia i chodnik ) za znakiem zakazu,NIEPRAWIDŁOWE PARKOWANIE,ŁUŻYCKA /,0,,2018-07-29 18:32:45
2018-07-29 21:41:00,INT-29846/18,"na ul. Wierzbowej, koło straży pożarnej (po obu stronach) oraz na odcinku Mennicza - Kazimierza Wielkiego, nieopodal apartamentów hotelowych. Pojazdy stoją tam za zakazem od samego rana. ",NIEPRAWIDŁOWE PARKOWANIE,KAZIMIERZA WIELKIEGO /,100,,2018-07-29 22:46:06
2018-07-29 22:25:00,INT-30384/18,Parkowanie za D-40 w miejscu niewyznaczonym,BLOKADA,ZAMKOWA /,0,,2018-08-03 10:33:31
2018-07-29 22:40:03,INT-29850/18,"a Słowiańska, szary samochód parkuje na przejściu dla pieszych stwarzając zagrożenie w ruchu drogowym.",NIEPRAWIDŁOWE PARKOWANIE,OŁBIŃSKA /,100,,2018-07-29 23:31:07
2018-07-30 02:33:47,INT-29855/18,patrol w trakcie kontroli rejonu zauważył brak szpady na pomniku szermierza.,PORZĄDKOWA,PLAC UNIWERSYTECKI /,100,,2018-07-30 02:57:07
2018-07-30 07:47:18,INT-29863/18,pojazdy na sakazie zatrzymywania się Wrocławskie Centrum Integracji,NIEPRAWIDŁOWE PARKOWANIE,STRZEGOMSKA 49/,100,,2018-07-30 14:26:23
2018-07-30 07:55:00,INT-29868/18,Parkowanie za B-36 i T-24 oraz za D-40 w miejcu niewyznaczonym,LAWETY,KOTLARSKA /,100,,2018-07-30 08:39:24
2018-07-30 08:20:00,INT-29971/18,Parkowanie za B36,NIEPRAWIDŁOWE PARKOWANIE,RUSKA /,MANDAT,100,2018-07-30 19:25:59
2018-07-30 08:49:27,INT-29871/18,"a ul. Ulanowskiego, parkowanie na skrzyżowaniu,utrudniony przejazd.",NIEPRAWIDŁOWE PARKOWANIE,JASTRZĘBIA /,0,,2018-07-30 09:20:39
2018-07-30 09:45:00,INT-29883/18,parkowanie pojazdu w odległości mniejszej niz 10 m od przejścia dla pieszych,NIEPRAWIDŁOWE PARKOWANIE,WŁODKOWICA /,MANDAT,100,2018-07-30 10:43:24
2018-07-30 09:45:00,INT-29963/18,Parkowanie na kopercie dla osoby niepełnosprawnej ,NIEPRAWIDŁOWE PARKOWANIE,SIENKIEWICZA /,MANDAT,500,2018-07-30 18:46:44
2018-07-30 10:10:00,INT-29969/18,Handel na terenie Parku Kulturowego,HANDEL,OŁAWSKA /,MANDAT,200,2018-07-30 19:23:28
2018-07-30 10:12:11,INT-29881/18,"Sklepy TOMA Market i Idefix wyrzucają opakowania do pojemników zapychają śmietniki oraz robią duży balagan przy nich, nie mają osobnych pojemników na odpady z działaności gospodarczej, wg zglaszającego informowano zarządcę TBS ale nie przyniosło to rezultatu.ZO.4042.529.2018.MM ",PORZĄDKOWA,DOLNOBRZESKA 36-40A/,SĄD REJONOWY,0,2018-08-01 15:47:27
2018-07-30 10:15:57,INT-29880/18,koperty dla melexów zajęte przez pojazdy nieuprawnione.,NIEPRAWIDŁOWE PARKOWANIE,ODRZAŃSKA 1-3/,100,,2018-07-30 11:56:32
2018-07-30 10:15:57,INT-29880/18,koperty dla melexów zajęte przez pojazdy nieuprawnione.,NIEPRAWIDŁOWE PARKOWANIE,ODRZAŃSKA 1-3/,50,,2018-07-30 11:56:32
2018-07-30 10:20:00,INT-29972/18,Kontrola parkowania pojazdów,NIEPRAWIDŁOWE PARKOWANIE,RUSKA /,MANDAT,100,2018-07-30 19:31:44
2018-07-30 11:56:58,INT-29896/18,Odrzańska parkowanie za znakiem B-36 T-24,NIEPRAWIDŁOWE PARKOWANIE,ODRZAŃSKA /,100,,2018-07-30 12:43:16
2018-07-30 12:00:00,INT-29973/18,Brak nakazanych środków ostroznosci przy trzymaniu zwierzecia,PIES,GOŁĘŻYCKA /,MANDAT,100,2018-07-30 19:39:00
2018-07-30 15:16:09,INT-29918/18,postój za b-35 ( powyżej 15 min0,NIEPRAWIDŁOWE PARKOWANIE,WYSTAWOWA /,0,,2018-07-30 15:16:13
2018-07-30 15:38:50,INT-29921/18,"D-40, parkowanie w miejscach niewyznaczonych.",NIEPRAWIDŁOWE PARKOWANIE,KRAKOWSKA 84/,0,,2018-07-30 16:54:53
2018-07-30 16:22:22,INT-29925/18,Przed bramąwejściową do budynku spożywanie alkoholu.,SPOŻYWANIE ALKOHOLU,BUDZISZYŃSKA 34A/,100,,2018-07-30 17:19:49
2018-07-30 16:27:52,INT-29927/18,"przy szkole, parkowanie za B-36 + chodnik,brak 1.5m przejścia.ZO.4042.528.2018.MM",NIEPRAWIDŁOWE PARKOWANIE,REJA /,SĄD,0,2018-08-01 16:39:36
2018-07-30 17:26:23,INT-29946/18,"pomiędzy ul. Łaciarska a ul. Jodłowa,parkowanie pojazdów za B-36.",NIEPRAWIDŁOWE PARKOWANIE,NOŻOWNICZA /,100,,2018-07-30 19:50:16
2018-07-30 18:22:05,INT-29957/18,parkowanie na całej szerokości chodnika- Toyota.,NIEPRAWIDŁOWE PARKOWANIE,BULWAR DEDALA 9/,0,,2018-07-30 18:54:43
2018-07-30 18:55:22,INT-29965/18,TAXI-parkują pojazdy nieuprawnione.,NIEPRAWIDŁOWE PARKOWANIE,ŁACIARSKA /,WEZWANIE,0,2018-07-30 21:46:02
2018-07-30 20:22:12,INT-29977/18,a Pestalloziego na skrzyzowaniu zaparkowany czarny samochód utrudnia ruch,NIEPRAWIDŁOWE PARKOWANIE,BARLICKIEGO /,0,,2018-07-30 22:18:56
2018-07-31 07:58:28,INT-30000/18,"brak 1,5 m. przejścia na chodniku",NIEPRAWIDŁOWE PARKOWANIE,OPOCZYŃSKA /,0,,2018-07-31 07:58:36
2018-07-31 08:15:00,INT-30060/18,Handel na terenie Parku Kulturowego,HANDEL,OŁAWSKA /,MANDAT,300,2018-07-31 15:33:21
2018-07-31 08:33:08,INT-30006/18,"Muzeum Historia Zajezdnia pojazdy zaparkowane na drodze dojazdowej, droga przeciw pożarowa, na zakazie zatrzymywania się.",NIEPRAWIDŁOWE PARKOWANIE,GRABISZYŃSKA /,LAWETA,100,2018-07-31 10:55:08
2018-07-31 09:30:00,INT-30023/18,"Parkowanie na chodniku, brak pozostawienia 1,5 m przejścia dla pieszych",NIEPRAWIDŁOWE PARKOWANIE,PIŁAWSKA /,0,,2018-07-31 10:30:02
